name	category	price	rating	url	description
Набор пасхальных наклеек «ХВ», 16×9.5 см	Флористика	8.1	5	https://www.sima-land.ru/6536003/nabor-pashalnyh-nakleek-hv-16-9-5-cm/	Набор наклеек "ХВ", 16 х 9,5 см,6 шт.  Наклейки выполнены на самоклеящейся бумаге высокого качества.  Характеристики: Тематика - Православная Тематика праздника - Пасха 
Светоотражающий элемент «Флажок», 15×3 см, жёлтый, оранжевый, зелёный	Декоративные элементы для одежды	37	4.9	https://www.sima-land.ru/1847933/svetootrazhayuschiy-element-flazhok-15-3-cm-zheltyy-oranzhevyy-zelenyy/	Безопасность ребёнка на улице — первоочередная задача для всех заботливых родителей, особенно вблизи проезжей части. Красивый светоотражающий брелок выделит кроху из толпы прохожих, и водители издалека увидят малютку. Изделие легко можно разместить на элементах одежды, рюкзаке или школьном портфеле, а также транспортном средстве, например велосипеде или самокате.
Альбом 500 наклеек, А4, 12 стр., Синий трактор	Детские книги	410	5	https://www.sima-land.ru/9843458/albom-500-nakleek-a4-12-str-siniy-traktor/	Альбом с наклейками «Синий трактор» станет отличным подарком для детей, которые любят творчество и мультфильмы. Это удобный формат для весёлого и полезного досуга, который понравится как мальчикам, так и девочкам. Ребёнок сможет погрузиться в мир любимых персонажей, создавая собственные аппликации и фантазийные сцены. Особенности Работа с наклейками помогает развивать у ребёнка мелкую моторику, усидчивость и внимание к деталям. Это идеальный вариант для укрепления фантазии и создания уникальных сюжетов с любимыми героями. Родители могут заниматься творчеством вместе с малышом, превращая процесс в увлекательное совместное занятие. Такой стикербук станет удачным выбором для подарка на день рождения, Новый год или другой праздник. Компактный формат и универсальная тематика делают его подходящим презентом для каждого ребёнка, который обожает творческие занятия и мультфильмы.
Пластилин 12 цветов 180 г ZOO	Принадлежности для лепки	152	4.9	https://www.sima-land.ru/4719408/plastilin-12-cvetov-180-g-zoo/	
Набор маркеров для флипчарта, 4 цвета, 3 мм, блистер	Письменные принадлежности	160	4.8	https://www.sima-land.ru/2393961/nabor-markerov-dlya-flipcharta-4-cveta-3-mm-blister/	Маркеры водные из этого набора предназначены для письма на флипчартах. Чернила легко стираются сухой губкой длядосок. 4 цвета. Диаметр пишущего узла: 3 мм. Тип наконечника: пулевидный. Упаковка: в блистере. Состав: пластик.
Акварель 24 цвета Calligrata TOP, пластик, европодвес	Принадлежности для рисования	176	4.8	https://www.sima-land.ru/5400713/akvarel-24-cveta-calligrata-top-plastik-evropodves/	Раскройте палитру возможностей с акварелью Calligrata TOP! Набор акварельных красок, 24 цвета – это профессиональный инструмент для художников и любителей. Краски упакованы в пластиковый футляр с европодвесом, что делает их удобными для хранения и демонстрации в магазинах. Для кого этот набор? Акварель Calligrata TOP подойдет профессиональным художникам, студентам художественных школ и всем, кто ценит качественные материалы для творчества. Это отличный выбор для создания иллюстраций, пейзажей и портретов. Почему выбирают Calligrata TOP? Краски легко наносятся на бумагу, создавая ровные слои без разводов. Они подходят для различных техник, включая мокрое по мокрому и сухую кисть. Набор станет надежным помощником в вашем творчестве. Попробуйте акварель Calligrata TOP – и создавайте работы, которые вдохновляют! Трещина на акварели не является браком. Акварель трескается из-за испарения воды, которая была в составе краски. Чтобы восстановить рабочие свойства краски, необходимо восполнить нехватку жидкости
Раскраски для малышей набор, 8 шт. по 12 стр., А5	Детские книги	309	5	https://www.sima-land.ru/9953538/raskraski-dlya-malyshey-nabor-8-sht-po-12-str-a5/	Набор раскрасок станет прекрасным выбором для творчества малышей. Комплект включает несколько книжечек, каждая из которых содержит страницы с увлекательными рисунками. Такие раскраски помогут ребёнку провести время с интересом и пользой. Особенности Раскрашивание — это не только увлекательное занятие, но и важный элемент развития ребёнка. Работа с раскрасками помогает тренировать мелкую моторику, улучшает концентрацию и развивает воображение. Малыш учится различать цвета, разрабатывать свой стиль и проявлять креативность. Набор раскрасок в формате А5 удобно хранить дома или брать с собой в поездки. Они станут отличным помощником для родителей, чтобы занять ребёнка в пути или в ожидании. Компактные книжки легко помещаются в рюкзак или сумку. Почему это удобно? Этот набор — это готовое решение для маленьких любителей рисования. Подойдёт как для ежедневного досуга, так и в качестве подарка к празднику!
Гуашь 24 цвета Calligrata, по 17 мл	Принадлежности для рисования	149	4.1	https://www.sima-land.ru/5400723/guash-24-cveta-calligrata-po-17-ml/	Гуашь для рисования Calligrata серии "Отличный выбор" предназначена для творческих занятий в школе и дома. Характеристика:
Наклейки набор «Наряди куколку. Для малышей», 4 шт. по 12 стр.	Детские книги	546	5	https://www.sima-land.ru/4177174/nakleyki-nabor-naryadi-kukolku-dlya-malyshey-4-sht-po-12-str/	Серия книг «Наряди куколку» создана специально для юных модниц! Ребёнок сможет сочетать яркую одежду и аксессуары и почувствует себя настоящим стилистом. Создавайте вместе с ребёнком самые необычные образы для всех случаев жизни. В наборе 4 книги разной тематики: В каждой книге малышку ждёт более 100 цветных наклеек с одеждой и аксессуарами для кукол. Рекомендовано для детей от 3 лет.
Пакет для цветов «Счастье», 42 × 44 × 32 см	Упаковка для цветов	236	5	https://www.sima-land.ru/9590666/paket-dlya-cvetov-schaste-42-44-32-cm/	
Бумага упаковочная тишью, «Конфетти», белая, 50×66 см	Подарочная упаковка	13.4	4.8	https://www.sima-land.ru/9618335/bumaga-upakovochnaya-tishyu-konfetti-belaya-50-66-cm/	Праздничное оформление для особых моментов! Бумага тишью с конфетти 50×66 см — идеальное решение для создания нарядной упаковки. Нежные крапинки на белом фоне добавляют торжественности любому подарку. Где использовать: Для упаковки подарков, декора подарочных коробок, оформления праздничных композиций. Особенно эффектно смотрится в многослойной упаковке с атласными лентами. Выбирайте праздничную бумагу — она сделает ваш подарок запоминающимся!
Булавки портновские «Ромашка», 38 мм, 40 шт, цвет МИКС	Принадлежности для шитья	14.3	3.5	https://www.sima-land.ru/600389/bulavki-portnovskie-romashka-38-mm-40-sht-cvet-miks/	Портновские булавки с разноцветным верхом станут помощниками в процессе раскройки ткани и примерки одежды. Удобные булавки помогут исправить небольшие изъяны или придадут изделию новую форму. 
Губка флористическая для живых цветов UPAK LANd=22.5×10.5×7 см	Флористика	90	4.4	https://www.sima-land.ru/9196596/gubka-floristicheskaya-dlya-zhivyh-cvetov-upak-land-22-5-10-5-7-cm/	О флористических губках: Флористическую губку (пиафлор) используют как базу для создания цветочных композиций. Пиафлор впитывает воду и питает ей цветы, что позволяет продлить срок жизни композиций из живых цветов. Губка легко режется ножом. Ей можно придать форму сосуда, в котором вы будете делать букет. К примеру, кашпо или стаканчика для цветов. Об этой губке: Рекомендации: Погружайте в воду без чрезмерных усилий. Размещайте в герметичные ёмкости. Используйте однократно. Умеренно поливайте водой при подсыхании.
Набор для украшения яиц в 3D коробке «Светлой Пасхи!», 12,5 х 15,5 см	Бакалея	109	5	https://www.sima-land.ru/9212156/nabor-dlya-ukrasheniya-yaic-v-3d-korobke-svetloy-pashi-12-5-h-15-5-cm/	В Пасхальный набор для украшения яиц входит: - набор пищевых красителей, 4 цвета - 1 шт; - декоративные элементы для яиц; - лист двухстороннего скотча - 1 шт; - перчатки - 2 шт.
Ваза для цветов под срезку Альтернатива, 3 л, пластиковая, белая	Вазы	259	4.8	https://www.sima-land.ru/2645117/vaza-dlya-cvetov-pod-srezku-alternativa-3-l-plastikovaya-belaya/	Любой, даже самый современный и продуманный интерьер будет не завершённым без растений. Они не только очищают воздух и насыщают его кислородом, но и заметно украшают окружающее пространство. Такому полезному «члену семьи» просто необходимо красивое и функциональное кашпо, оригинальный горшок или необычная ваза! Мы предлагаем — кашпо-вазон! Оптимальный выбор материала — пластмасса! Почему мы так считаем? Соблюдая нехитрые правила ухода, вы можете заметно продлить срок службы горшков, вазонов и кашпо из пластика: Создавайте прекрасные цветочные композиции, выращивайте рассаду или необычные растения, а низкие цены позволят вам не ограничивать себя в выборе.
Гравюра для девочек «Активити-книга. Фея», 5 гравюр, с заданиями, 12 стр., голографический фон	Гравюры	196	5	https://www.sima-land.ru/5306587/gravyura-dlya-devochek-aktiviti-kniga-feya-5-gravyur-s-zadaniyami-12-str-golograficheskiy-fon/	Яркая активити-книга с увлекательными заданиями для девочек поможет ребёнку скоротать время и провести его с пользой. С помощью пластикового штихеля девочка будет стирать специальный слой, за которым скрываются красочные картинки с голографическим фоном! 5 красивых гравюр не дадут заскучать, потренируют мелкую моторику и творческое мышление. Характеристики Активити-книга с гравюрами подойдёт в качестве презента, чтобы порадовать ребёнка или поощрить за успехи. Творчество подарит вашей девочке радость, станет любимым хобби, поможет отвлечься от гаджетов и провести время с пользой.
Коробка сборная без печати крышка-дно бурая с окном 37×32×7 см	Подарочная упаковка	196	4.4	https://www.sima-land.ru/4138436/korobka-sbornaya-bez-pechati-kryshka-dno-buraya-s-oknom-37-32-7-cm/	Коробка подарочная с окном - универсальное и стильное решение для упаковки и представления разнообразных товаров или подарков. Прозрачное окно позволяет визуально оценить содержимое коробки, придавая ему дополнительную привлекательность. Эта коробка сочетает в себе функциональность и визуальное привлечение, делая товары или подарки более привлекательными для покупателей или получателей. Коробка универсальная. Изготовлена из плотного картона. Прекрасно подойдет для оформления подарка, и праздничного декора. Можно использовать для хранения аксессуаров. Можно использовать множество раз. Преимущества:
Пластилин 18 цветов мягкий 360 г	Принадлежности для лепки	199	4.9	https://www.sima-land.ru/7581348/plastilin-18-cvetov-myagkiy-360-g/	Пластилин ArtFox STUDY серии «Персонажи» в картонной упаковке . Хорошо подойдет для школы, детского сада и дома. • Количество цветов: 18; • Температурный режим : до +35 °C • Форма бруска: прямоугольная
Набор кистей пони 4 штуки: № 2, 4, 6, 8, круглые, с деревянными ручками, в блистере	Принадлежности для рисования	81	3.9	https://www.sima-land.ru/1827410/nabor-kistey-poni-4-shtuki-2-4-6-8-kruglye-s-derevyannymi-ruchkami-v-blistere/	Кисти из синтетического волоса.
Пластилин мягкий (восковой), 12 цветов, 180 г, "Кроха", со стеком	Принадлежности для лепки	206	5	https://www.sima-land.ru/1026965/plastilin-myagkiy-voskovoy-12-cvetov-180-g-kroha-so-stekom/	Мягкий восковой пластилин «Кроха» создан в соответствии с предложениями и рекомендациями педагогов, работающих с детьми младшего возраста. Это очень мягкий и пластичный материал, обладающий необыкновенными качествами:
Раскраска, А4, 16 стр., Холодное сердце	Детские книги	82	5	https://www.sima-land.ru/9354642/raskraska-a4-16-str-holodnoe-serdce/	Суперраскраска со сказочными героями из мультфильма «Холодное сердце» надолго увлечёт всех творческих малышей. Они встретятся с Анной, Эльзой, Олафом и другими легендарными персонажами и весело и с пользой проведут время. Особенности суперраскраски Чем полезно раскрашивание для детей Занимаясь таким творчеством, ребёнок не только учится уверенно держать карандаш в руке, но и развивает наблюдательность, мелкую моторику, воображение и художественный вкус.
Карандаши 12 цветов Calligrata, заточенные, трехгранные, пластиковые, эконом, картонная упаковка, европодвес	Принадлежности для рисования	71	4.3	https://www.sima-land.ru/5386767/karandashi-12-cvetov-calligrata-zatochennye-trehgrannye-plastikovye-ekonom-kartonnaya-upakovka-evropodves/	Набор цветных карандашей бюджетной ценовой категории, 12 цветов, яркие цвета, стандартный средней жесткости грифель. Особенности
Лента атласная, 20 мм × 23±1 м, розовая №04	Ленты	58	5	https://www.sima-land.ru/1218225/lenta-atlasnaya-20-mm-23-1-m-rozovaya-04/	Декоративная атласная лента – это идеальный спутник для вашего творчества и праздников. Праздничный тренд, который всегда будет к месту. Упаковочная ленточка прекрасно подойдет для рукоделия, украшения подарков и создания удивительных композиций из воздушных шаров. Вы можете украсить букеты цветов, привязав к ним яркую ленточку. Это добавит особого очарования вашему подарку. Игрушки также можно сделать более интересными, если использовать красивую упаковочную ленту в оформлении. Она идеально подойдет для новогодних сюрпризов и рождественских даров. На дни рождения и другие важные события не обойтись без новогодней подарочной ленты. Упаковка коробок со сладкими подарками станет настоящим искусством с этой великолепной деталью. Она отлично сможет дополнить ваши идеи на 14 февраля, 23 февраля, 8 марта или в день матери. Кроме того, такая лента может стать оригинальным украшением на голове именинницы! Сделайте супер банты первоклассника или создайте необычный аксессуар для вечеринки. Ленты идеально подходят для шитья одежды, ведь они могут добавить немного волшебства каждому изделию. Наши ленточки не содержат люрекса, что делает их особенно приятными на ощупь и легко сочетаемыми с любыми материалами. Упаковочная лента займет достойное место в наборе швейной фурнитуры для творчества как тесьма. Благодаря своей универсальности она найдет применение в самых разных проектах. Если вы хотите украсить мероприятие или помочь с декором? Эта продукция станет незаменимой при создании флористических композиций. Завязывайте косички на девичник узкими атласными полосками, чтобы добавить романтики и стиля вашим праздникам. Не бойтесь проявлять фантазию! Делая ободки и бантики из этой чудесной ленточки, вы сможете создать уникальные украшения для волос и вечеринок. Создавайте шикарные розы своими руками – этот процесс принесет радость вам и всем вокруг! И не забудьте о праздничных елках! Используйте яркую упаковочную ленту, чтобы делать роскошные бантики прямо на ели. Это увидят все гости во время новогоднего веселья! Погрузитесь в мир творчества с атласной лентой! Ваши идеи будут воплощены легко и приятно, а результаты порадуют окружающих. Пусть каждое ваше творение станет произведением искусства! Атласная лента гладкая и приятная на ощупь. Используйте её для отделки изделий, украшения подарков, свадебного оформления, а также в техниках скрапбукинг и канзаши. При производстве лент используется только современное оборудование и качественные материалы.
