name	category	price	rating	url	description
Подушечки клеевые, двусторонние, квадратные, размер 1 шт. — 0.5×0.5 см	Принадлежности для творчества	49	4.9	https://www.sima-land.ru/1565745/podushechki-kleevye-dvustoronnie-kvadratnye-razmer-1-sht-0-5-0-5-cm/	Клеевые двухсторонние подушечки — это необходимый инструмент для любителей скрапбукинга и других видов творчества. Они выполнены из мягкого и прочного EVA-материала и бумаги. Подушечки очень просты в использовании: отделите их от основы, снимите защитный слой и приклейте к необходимой поверхности. Они подходят для закрепления фотографий, бумаги и других декоративных элементов. Особенности
Шар декоративный из лианы, набор 5 шт., размер 1 шт. — 3 см, цвет белый	Принадлежности для творчества	159	5	https://www.sima-land.ru/9192474/shar-dekorativnyy-iz-liany-nabor-5-sht-razmer-1-sht-3-cm-cvet-belyy/	Декоративный шар из лианы — прекрасный элемент для создания уютного и природного декора. В набор входят пять белых шаров, изготовленных из дерева, которые подойдут для оформления интерьера, создания композиций или использования в креативных проектах. Особенности
Фигурка для поделок и декорирования «Шарик» набор 30 шт., размер 1 шт: 1,5 × 1,5 см	Принадлежности для творчества	178	5	https://www.sima-land.ru/511695/figurka-dlya-podelok-i-dekorirovaniya-sharik-nabor-30-sht-razmer-1-sht-1-5-1-5-cm/	Фигурка из пенопласта используется в качестве заготовки для творчества. Такую основу можно декорировать в различных техниках: декупаж, кракелюр, художественная роспись (акриловыми красками на водной основе) и роспись универсальными контурами, мозаика, позолота и т. д.
Набор для опытов «Мой мини-сад: Динозаврики», вырасти травку	Опыты	265	5	https://www.sima-land.ru/7562842/nabor-dlya-opytov-moy-mini-sad-dinozavriki-vyrasti-travku/	Набор для опытов «Мой мини-сад: Динозаврики» станет прекрасным способом занять детей и показать им процесс прорастания семян. Ребёнок самостоятельно вырастит декоративную травку в домашних условиях и научится ухаживать за растением. Особенности Как использовать набор Набор рекомендован детям от 3 лет.
Набор для опытов, для детей «Пташки, выращиваем травку», растение в жёлтом горшочке	Опыты	194	5	https://www.sima-land.ru/5155391/nabor-dlya-opytov-dlya-detey-ptashki-vyraschivaem-travku-rastenie-v-zheltom-gorshochke/	Набор для опытов «Выращиваем травку» станет прекрасным способом занять детей и показать им процесс прорастания семян. Ребёнок самостоятельно вырастит декоративную травку в домашних условиях и научится ухаживать за растением. Познакомьте ребёнка с волшебным миром ботаники! Особенности Инструкция Набор рекомендован детям от 4 лет.
Раскраски для девочек набор «Для маленьких принцесс», 8 шт. по 12 стр.	Детские книги	251	5	https://www.sima-land.ru/4330586/raskraski-dlya-devochek-nabor-dlya-malenkih-princess-8-sht-po-12-str/	Набор раскрасок «Для маленьких принцесс» — это не просто набор, а захватывающее приключение в мир творчества для вашей маленькой леди! Вместе с принцессами, феями, лошадками и котиками малышка окунётся в сказочный мир, придумает истории, развивая при этом множество полезных навыков. Преимущества Рекомендовано для детей старше 3 лет.
Раскраски набор «Мои первые раскраски», 12 шт. по 16 стр.	Детские книги	438	5	https://www.sima-land.ru/2656396/raskraski-nabor-moi-pervye-raskraski-12-sht-po-16-str/	Набор «Мои первые раскраски» поможет малышу освоить новый вид творчества. В наборе собраны раскраски различной тематики: Особенности раскраски Польза пальчикового рисования Рекомендуется детям от 5 лет.
Лента «Георгиевская» репсовая, 25 мм, 23 ± 1 м	Ленты	229	4.9	https://www.sima-land.ru/2834729/lenta-georgievskaya-repsovaya-25-mm-23-1-m/	Георгиевская лента — главный атрибут Дня Победы. 9 мая миллионы людей прикрепляют ленточки и отправляются праздновать освобождение от фашистских захватчиков. Георгиевская лента объединила людей и стала знаком благодарности за мирное небо над головой. Каждый год 9 мая мы крепим георгиевские ленточки, чтобы проявить уважение к воинам и показать, что память об их подвиге жива.  К сожалению, некоторые воспринимают символ Победы как украшение и крепят его куда хотят. Организаторы акции «Георгиевская ленточка» призывают носить ленту у сердца — как награду и знак памяти. Закрепить её можно в виде банта или петельки.
Набор для опытов «Мой мини-сад: Пони», вырасти травку	Опыты	280	5	https://www.sima-land.ru/7562843/nabor-dlya-opytov-moy-mini-sad-poni-vyrasti-travku/	Набор для опытов «Мой мини-сад: Пони» станет прекрасным способом занять детей и показать им процесс прорастания семян. Ребёнок самостоятельно вырастит декоративную травку в домашних условиях и научится ухаживать за растением. Особенности Как использовать набор Набор рекомендован детям от 3 лет.
Раскраски «Для девочек», набор 8 шт. по 12 стр.	Детские книги	251	5	https://www.sima-land.ru/5214449/raskraski-dlya-devochek-nabor-8-sht-po-12-str/	Набор раскрасок «Для девочек» поможет провести время творчески и потренировать важные навыки. Особенности набора Чем полезно раскрашивание для детей Занимаясь таким творчеством, ребёнок не только учится уверенно держать карандаш в руке, но и развивает наблюдательность, мелкую моторику, воображение и художественный вкус.
Набор для опытов, для детей «Котики. Выращиваем травку», растение в фиолетовом горшочке	Опыты	277	5	https://www.sima-land.ru/9415586/nabor-dlya-opytov-dlya-detey-kotiki-vyraschivaem-travku-rastenie-v-fioletovom-gorshochke/	Набор для опытов «Выращиваем травку» станет прекрасным способом занять детей и показать им процесс прорастания семян. Ребёнок самостоятельно вырастит декоративную травку в домашних условиях и научится ухаживать за растением. Познакомьте ребёнка с волшебным миром ботаники! Особенности Инструкция Набор рекомендован детям от 4 лет.
Мольберт телескопический, тренога, металлический	Товары для художников	815	5	https://www.sima-land.ru/1093578/molbert-teleskopicheskiy-trenoga-metallicheskiy/	Данный мольберт предназначен для черчения и живописи. Отлично подходит как для любителей, так и для профессиональных художников. Каждая из трёх телескопических ножек индивидуально регулируется, что позволяет установить мольберт даже на неровной поверхности.  Характеристики  Габариты 
Набор раскрасок «Весёлые задания», 8 шт. по 12 стр.	Детские книги	293	5	https://www.sima-land.ru/4834967/nabor-raskrasok-veselye-zadaniya-8-sht-po-12-str/	Дети обожают раскраски! А раскраски с заданиями — это не только весело, но и полезно. С серией книг «Самая умная раскраска» ребёнок получит новые знания и интересно проведёт время. В наборе собраны раскраски с различными тематиками: Занимаясь с такими раскрасками, ребёнок получит всестороннее развитие и расширит свой кругозор. Рекомендуется детям от 5 лет.
Набор для опытов, для детей «Котики. Выращиваем травку», растение в жёлтом горшочке	Опыты	277	5	https://www.sima-land.ru/9415588/nabor-dlya-opytov-dlya-detey-kotiki-vyraschivaem-travku-rastenie-v-zheltom-gorshochke/	Набор для опытов «Выращиваем травку» станет прекрасным способом занять детей и показать им процесс прорастания семян. Ребёнок самостоятельно вырастит декоративную травку в домашних условиях и научится ухаживать за растением. Познакомьте ребёнка с волшебным миром ботаники! Особенности Инструкция Набор рекомендован детям от 4 лет.
Раскраски набор WOW Girls, А5, 6 шт. по 12 стр.	Детские книги	229	5	https://www.sima-land.ru/7339134/raskraski-nabor-wow-girls-a5-6-sht-po-12-str/	Набор раскрасок WOW-Girls создан специально для маленьких модниц. Особенности раскрасок Чем полезно раскрашивание
Картина по номерам для детей «Милые котята», 15 х 15 см	Картины по номерам	269	4.9	https://www.sima-land.ru/4719045/kartina-po-nomeram-dlya-detey-milye-kotyata-15-h-15-cm/	Подарите маленькому художнику картину по номерам, и через пару мгновений он создаст шедевр! Как раскрасить картину по номерам Готовая картина украсит детскую комнату или станет оригинальным подарком близкому человеку.
Бумага упаковочная тишью, белый, 50 см × 66 см	Подарочная упаковка	9.4	4.9	https://www.sima-land.ru/2654614/bumaga-upakovochnaya-tishyu-belyy-50-cm-66-cm/	Бумага тишью или, как ее еще называют, папиросная обёрточная бумага - это тонкая, нежная и привлекательная декоративная бумага разных оттенков. Производится она из беленой сульфатной целлюлозы, получаемой из древесины деревьев хвойных пород. Папиросная бумага прекрасно подходит для того, чтобы обернуть подарок любой формы, её можно вложить в качестве наполнения в подарочные пакеты или коробки для придания дополнительного объема. Бумага тишью в сочетании с крафт-бумагой, шляпными коробками, атласными лентами является отличной упаковкой для цветов. Из бумаги тишью легко создавать помпоны, кисточки, гирлянды, украшать фоны для фотосессий и тематических зон на различных мероприятиях, создавать гигантские цветы или огромные цифры.
Книжка-раскраска «Рисуем водой», Синий трактор	Детские книги	369	5	https://www.sima-land.ru/9045630/knizhka-raskraska-risuem-vodoy-siniy-traktor/	Волшебная книга для рисования водой удивит малыша и его родителей! Изделие выполнено из плотного картона. Внутри есть 8 страниц для раскрашивания. Во время рисования малыш оживит своих любимых персонажей из мультфильма «Синий трактор» и вспомнит истории, которые с ними происходили. Как играть В комплекте есть волшебный маркер, который нужно заправлять водой. Маркер многоразовый, просто добавьте воду. Рекомендовано для детей от 3 лет.
Книжка 500 наклеек «Для девочек», 8 стр.	Детские книги	339	5	https://www.sima-land.ru/4608424/knizhka-500-nakleek-dlya-devochek-8-str/	С альбомом интерактивных наклеек познавать окружающий мир ребёнку будет легко и интересно. В альбоме представлено 500 наклеек с красочными изображениями. Яркие картинки положительно влияют на визуальное восприятие малыша, память и воображение. На каждой странице есть задания, в которых необходимо приклеить картинки с соответствующими персонажами и предметами или их определённое количество. Упражнения положительно влияют на развитие мелкой моторики, внимания, речи и расширение кругозора.
Маркер цветной на водной основе, с магнитом, набор 8 шт.	Письменные принадлежности	99	4.9	https://www.sima-land.ru/9939979/marker-cvetnoy-na-vodnoy-osnove-s-magnitom-nabor-8-sht/	Магнитные маркеры на водной основе удобны для использования в офисе, школе или дома. Идеальны для работы с планировочными досками, написания заметок на холодильнике, а также для проведения тренингов и презентаций. Написанное легко стирается с гладких поверхностей, маркеры не оставляют следов, поэтому они отлично подходят для временных записей. Особенности Набор маркеров подходит для учёбы, работы, а также для создания творческих проектов. Благодаря удобному магниту, маркеры всегда будут под рукой на рабочем месте или в классе. Они отлично подойдут в качестве подарка для коллег или друзей, которые ценят порядок и удобство в организации рабочего процесса.
Ваза «Трубка 200», 20×20 см, стекло, прозрачная	Вазы	1049	4.9	https://www.sima-land.ru/4342448/vaza-trubka-200-20-20-cm-steklo-prozrachnaya/	Эта прозрачная настольная ваза станет отличным дополнением к вашему интерьеру и идеальным подарком для близких. Она гармонично сочетается с любыми стилями оформления, добавляя комнате лёгкости и свежести. Преимущества Декоративное решение Ваза из качественного стекла выглядит элегантно и современно благодаря своей прозрачности и минималистичной форме. Она органично впишется в любой интерьер — от классического до хай-тек. С её помощью можно создавать эффектные цветочные композиции, которые станут центральной частью любого пространства. Подарок с душой Если вы ищете оригинальный подарок для близких или коллег, эта ваза станет отличным выбором. Она не только красиво оформлена, но и функциональна, что делает её практичным и запоминающимся презентом. Ваза станет символом вашего внимания и заботы, особенно если преподнести её на 8 Марта.
Альбом для рисования А4, 40 листов на скрепке Calligrata, обложка мелованный картон, внутренний блок офсет 100 г/м², МИКС	Бумага и бумажная продукция	52	4.9	https://www.sima-land.ru/5666534/albom-dlya-risovaniya-a4-40-listov-na-skrepke-calligrata-oblozhka-melovannyy-karton-vnutrenniy-blok-ofset-100-g-m-miks/	Альбом для рисования А4 - это не просто тетрадь для творчества, но и целый мир, который Вы можете создавать своими руками. Этот альбом станет вашим верным спутником в мире искусства, а также поможет воплотить самые смелые идеи и фантазии. Альбом - это незаменимая канцелярия, которая подойдёт как школьникам, любящим рисовать в больших объёмах на уроках и дома, так и взрослым, которые бывают не прочь отвлечься от ежедневной рутины и окунуться в мир творчества. Блок 100 г/м2. 
Маркер цветной на водной основе, с магнитом, набор 6 шт.	Письменные принадлежности	68	4.9	https://www.sima-land.ru/442632/marker-cvetnoy-na-vodnoy-osnove-s-magnitom-nabor-6-sht/	Находитесь в поиске маркеров для учебных или деловых презентаций на белой эмалевой доске? Маркеры цветные 6 цветов, водная основа, 6 шт. – подходящий выбор для самых успешных презентаций.  Этот вариант включает в себя все достоинства обычных маркеров для досок – насыщенный  цвет, ровную яркую линию, светоустойчивость.  Однако водная основа имеет свои особые преимущества. Маркеры на такой основе приятно пахнут, быстро высыхают и  легко стираются губкой. А самое главное – они абсолютно безвредны для здоровья,  поэтому особенно популярны в детских садах и  школах. Покупая такой маркер для магнитной доски с ощутимой выгодой, вы делаете правильный выбор.
Раскраски «Синий трактор», 4 шт. по 12 стр.	Детские книги	180	5	https://www.sima-land.ru/7333108/raskraski-siniy-traktor-4-sht-po-12-str/	Набор раскрасок с героями «Синего трактора» станет отличным выбором для творческого развития ребёнка. Эти книги предлагают увлекательные задания, которые помогают малышу учиться и фантазировать одновременно. Особенности Творчество с пользой Раскрашивание помогает ребёнку развивать мелкую моторику, уверенность в управлении карандашом и воображение. Каждый рисунок предлагает возможность создать уникальное произведение, а любимые герои «Синего трактора» делают процесс ещё более увлекательным. Этот набор станет не только источником развлечений, но и полезным инструментом для развития ребёнка. Его можно использовать как подарок на праздник или для повседневных занятий дома. Подарите малышу возможность творить и учиться одновременно!
Карандаши 12 цветов Calligrata, ЭКОНОМ, заточенные, шестигранные, пластиковые, картонная упаковка, европодвес	Принадлежности для рисования	49.9	4.5	https://www.sima-land.ru/5303321/karandashi-12-cvetov-calligrata-ekonom-zatochennye-shestigrannye-plastikovye-kartonnaya-upakovka-evropodves/	Карандаши 12 цветов Calligrata заточенные, шестигранные, пластиковые, в картонной упаковке с европодвесом.
Набор пальчиковых раскрасок, 4 шт. по 16 стр., А5, Синий трактор	Детские книги	169	5	https://www.sima-land.ru/7350590/nabor-palchikovyh-raskrasok-4-sht-po-16-str-a5-siniy-traktor/	Набор пальчиковых раскрасок представлен четырьмя книгами различной тематики: Пальчиковое рисование поможет маленькому художнику развить мелкую моторику ручек и раскрыть творческие способности. Кроха с удовольствием будет раскрашивать картинки, а изображения героев любимого мультфильма «Синий трактор» сделают творческие занятия ещё более интересными для малыша. Рекомендуется для детей старше 1 года. Для комфортного рисования рекомендуем использовать специальные пальчиковые краски, в комплект не входят.
