name	category	price	url	description
Набор приспособлений для изготовления помпонов, d = 3,5/5,5/7/9 см, 4 шт, цвет разноцветный	Создание слаймов	119	https://www.sima-land.ru/1215370/nabor-prisposobleniy-dlya-izgotovleniya-pomponov-d-3-5-5-5-7-9-cm-4-sht-cvet-raznocvetnyy/	Делайте весёлые помпоны для шапок и носочков самостоятельно. В этом вам поможет приспособление для изготовления помпонов. Устройство позволит вам и вашему ребёнку создать очаровательный декор для одежды или изготовить маленькие игрушки. В наборе представлены кольца диаметром 9 см, 7 см, 5,5 см, 3 см.
Спицы для вязания, чулочные, d=2.5 мм, 24 см, 5 шт.	Создание слаймов	40	https://www.sima-land.ru/1161198/spicy-dlya-vyazaniya-chulochnye-d-2-5-mm-24-cm-5-sht/	Рукоделие и handmade-вещицы становится настоящим трендом: на смену аксессуарам и предметам одежды именитых домов моды пришли вещи, созданные собственными руками. Вязать и шить оригинальные предметы одежды станет проще со стальными спицами.  Благодаря прочному материалу они прослужат вам долго и не согнутся под весом изделия во время вязания. С их помощью вы самостоятельно свяжете тёплые гольфы, чулки и носочки, которые так актуальны в холодное время года. 
Крючок для вязания, с пластиковой ручкой, d = 3 мм, 13,5 см, цвет синий, цена за 1 штуку	Создание слаймов	1950	https://www.sima-land.ru/1161179/kryuchok-dlya-vyazaniya-s-plastikovoy-ruchkoy-d-3-mm-13-5-cm-cvet-siniy-cena-za-1-shtuku/	Handmade-изделия никогда не теряют своей актуальности. Вооружитесь крючком и создавайте свои собственные рукодельные шедевры. Удобная пластиковая ручка не даст инструменту выскользнуть из рук, и вы легко и уверенно свяжете целый свитер, кофту или просто декоративную салфетку. Главное, что всё это будет выполнено в вашем неповторимом стиле, и вы сможете порадовать уникальными вещами себя и своих близких. 
Набор крючков для вязания, d = 0,6-6,5 мм, 12,5/15 см, 22 шт, цвет МИКС	Создание слаймов	449	https://www.sima-land.ru/1161180/nabor-kryuchkov-dlya-vyazaniya-d-0-6-6-5-mm-12-5-15-cm-22-sht-cvet-miks/	Рукоделие стало настоящим трендом: вместо дизайнерских аксессуаров и предметов одежды в моду вошли вещи, созданные собственными руками. Удобные крючки в футляре сделают процесс наполнения гардероба уникальными изделиями проще.  Вооружитесь инструментами, чтобы создавать настоящие шедевры: единственные в своём роде перчатки, варежки, шапочки и многое другое станут возможны с этой небольшой принадлежностью для вязания.  Дополнительные характеристики:  
Набор крючков для вязания, d = 2-8 мм, 14,5 см, 12 шт, цвет разноцветный	Создание слаймов	225	https://www.sima-land.ru/744676/nabor-kryuchkov-dlya-vyazaniya-d-2-8-mm-14-5-cm-12-sht-cvet-raznocvetnyy/	Вооружитесь крючком, чтобы самостоятельно создавать настоящие шедевры: единственные в своем роде перчатки, варежки, шапочки и многое другое станут возможны с этой небольшой принадлежностью для вязания. Аксессуар удобно лежит в руке.
Крючок для вязания, с силиконовой ручкой, d = 3 мм, 14 см, цвет розовый	Создание слаймов	77	https://www.sima-land.ru/1364633/kryuchok-dlya-vyazaniya-s-silikonovoy-ruchkoy-d-3-mm-14-cm-cvet-rozovyy/	 Крючки с силиконовой ручкой чуть тяжелее, чем крючки с пластиковыми ручками. Зато силикон обеспечивает надёжный хват и изделие не выскальзывает из руки в процессе вязания.
Крючок для вязания, с пластиковой ручкой, d = 4 мм, 14 см, цвет фиолетовый	Создание слаймов	36	https://www.sima-land.ru/1215365/kryuchok-dlya-vyazaniya-s-plastikovoy-ruchkoy-d-4-mm-14-cm-cvet-fioletovyy/	Handmade-изделия никогда не теряют своей актуальности. Вооружитесь крючком и создавайте свои собственные рукодельные шедевры. Это может быть целый свитер, кофта или просто декоративная салфетка, но всё это будет выполнено в вашем, неповторимом стиле. Порадуйте уникальными вещами себя и своих близких. 
Маркер для петель, разноцветный, цена за 1 штуку	Создание слаймов	062	https://www.sima-land.ru/7112204/marker-dlya-petel-raznocvetnyy-cena-za-1-shtuku/	Булавки используются для отметки различных участков вязания: петли реглана, места начала прибавления петель или кругового оборота. С помощью маркировочных колец и булавок можно сделать отметки на полотне: выделить нужный ряд или петлю. Длинный хвостик легко вдевается в петлю или столбик, затем фиксируется в замке, не деформирует и не растягивает вязку. Разными цветами удобно помечать участки в одном изделии: выделить спинку, пройму, полочку. Если допущена ошибка, можно за пару секунд снять и переставить булавку на другое место.
Набор крючков для вязания, d = 2-5 мм, 14 см, 4 шт, цвет разноцветный	Создание слаймов	238	https://www.sima-land.ru/6906730/nabor-kryuchkov-dlya-vyazaniya-d-2-5-mm-14-cm-4-sht-cvet-raznocvetnyy/	Handmade-изделия никогда не теряют своей актуальности. Вооружитесь тонким металлическим крючком и создавайте свои собственные рукодельные шедевры. Такой инструмент подойдёт для вывязывания мелких деталей и создания изящных салфеток, украшений и других декоративных элементов. Дополнительные характеристики:
Набор крючков для вязания, d = 0,5-1 мм, 12 см, 6 шт	Создание слаймов	129	https://www.sima-land.ru/1161174/nabor-kryuchkov-dlya-vyazaniya-d-0-5-1-mm-12-cm-6-sht/	Handmade-изделия никогда не теряют своей актуальности. Вооружитесь тонким металлическим крючком и создавайте свои собственные рукодельные шедевры. Такой инструмент подойдёт для вывязывания мелких деталей и создания изящных салфеток, украшений и других декоративных элементов. Дополнительные характеристики:
Спицы круговые, для вязания, с металлическим тросом, d = 3 мм, 14/80 см	Создание слаймов	4380	https://www.sima-land.ru/2609984/spicy-krugovye-dlya-vyazaniya-s-metallicheskim-trosom-d-3-mm-14-80-cm/	Handmade становится популярным трендом: на место дизайнерских аксессуаров и предметов одежды пришли вещи, сделанные собственными руками.  Круговые спицы представляют собой две металлические части, соединённые друг с другом тросиком. Инструмент незаменим при вязании полотна по кругу. С его помощью получаются изделия без дополнительных швов: шапки, рукава и горловины.  Указанная длина круговых спиц содержит длину одной спицы и общую длину от кончика одной спицы до кончика второй, включая длину троса. Например, значение 14/80 см означает, что длина одной спицы составляет 14 см. А общая длина от кончика одной спицы до кончика второй, включая длину троса, — 80 см.
Набор маркеров для петель, 2 см, 120 шт., в контейнере, 12.7×6.5×2.1 см, разноцветный	Создание слаймов	114	https://www.sima-land.ru/7338415/nabor-markerov-dlya-petel-2-cm-120-sht-v-konteynere-12-7-6-5-2-1-cm-raznocvetnyy/	Булавки используются для отметки различных участков вязания: петли реглана, места начала прибавления петель или кругового оборота. С помощью маркировочных колец и булавок можно сделать отметки на полотне: выделить нужный ряд или петлю. Длинный хвостик легко вдевается в петлю или столбик, затем фиксируется в замке, не деформирует и не растягивает вязку. Разными цветами удобно помечать участки в одном изделии: выделить спинку, пройму, полочку. Если допущена ошибка, можно за пару секунд снять и переставить булавку на другое место.
Набор вспомогательных булавок для вязания, 9 см, 5 шт., зелёный	Создание слаймов	73	https://www.sima-land.ru/1053269/nabor-vspomogatelnyh-bulavok-dlya-vyazaniya-9-cm-5-sht-zelenyy/	Если вы только недавно занялись вязанием или, напротив, занимаетесь им уже давно и хотите облегчить этот процесс, то булавка для вязания станет незаменимой помощницей.  Она пригодится, когда некоторое количество петель необходимо отложить, так как они временно не нужны для работы. Подобные петли появляются, к примеру, при вязании кармана или носка.  Скиньте петли на булавку и закройте её. Так они будут надёжно закреплены до тех пор, пока снова не понадобятся в работе. 
Спицы круговые, для вязания, с металлическим тросом, d = 3 мм, 14/100 см	Создание слаймов	46	https://www.sima-land.ru/2609990/spicy-krugovye-dlya-vyazaniya-s-metallicheskim-trosom-d-3-mm-14-100-cm/	Handmade становится популярным трендом: на место дизайнерских аксессуаров и предметов одежды пришли вещи, сделанные собственными руками.  Круговые спицы представляют собой две металлические части, соединённые друг с другом тросиком. Инструмент незаменим при вязании полотна по кругу. С его помощью получаются изделия без дополнительных швов: шапки, рукава и горловины.  Указанная длина круговых спиц содержит длину одной спицы и общую длину от кончика одной спицы до кончика второй, включая длину троса. Например, значение 14/100 см означает, что длина одной спицы составляет 14 см. А общая длина от кончика одной спицы до кончика второй, включая длину троса, — 100 см.
Набор для вязания. Амигуруми: мягкая игрушка своими руками «Заинька Банни», 33 см	Создание слаймов	290	https://www.sima-land.ru/2724103/nabor-dlya-vyazaniya-amigurumi-myagkaya-igrushka-svoimi-rukami-zainka-banni-33-cm/	С нашим набором для творчества вы легко создадите красивую и уникальную игрушку. Особенности набора: Развивайте навыки вязания крючком и радуйте близких оригинальными подарками ручной работы. Желаем вам приятных минут творчества!
Спицы для вязания, чулочные, гибкие, d=2.5 мм, 21 см, 3 шт.	Создание слаймов	71	https://www.sima-land.ru/6895555/spicy-dlya-vyazaniya-chulochnye-gibkie-d-2-5-mm-21-cm-3-sht/	Гибкие спицы идеально подходят для изделий небольшого размера: носков, варежек, гольф. Петли распределяются по двум спицам и провязываются при помощи третьей спицы, таким образом уменьшается количество переходов. И за счёт этого ускоряется процесс вязания. Гибкие спицы также можно использовать в качестве вспомогательных при вывязывании кос.
Набор крючков для вязания, d = 8/9/10/12/15 мм, 5 шт , цвет разноцветный	Создание слаймов	179	https://www.sima-land.ru/7084328/nabor-kryuchkov-dlya-vyazaniya-d-8-9-10-12-15-mm-5-sht-cvet-raznocvetnyy/	Handmade-изделия никогда не теряют своей актуальности. Вооружитесь тонким металлическим крючком и создавайте свои собственные рукодельные шедевры. Такой инструмент подойдёт для вывязывания мелких деталей и создания изящных салфеток, украшений и других декоративных элементов.
Кольцо-маркер для вязания, d=1.6 / 2.1 см, 20 шт., разноцветное	Создание слаймов	27	https://www.sima-land.ru/1161163/kolco-marker-dlya-vyazaniya-d-1-6-2-1-cm-20-sht-raznocvetnoe/	Вы оцените этих маленьких помощников, независимо от того, начинающая вы рукодельница или уже мастер своего дела.  Они применяются для маркировки начала и конца провязанного ряда. Приспособление особенно удобно использовать при вязании сложных круговых моделей, чтобы не спутать ряды или отметить расположение узоров.  Также маркеры пригодятся для соединения деталей изделия, например спинки и переда или рукава и проймы.  В набор входят:  10 колец диаметром 1,6 см, внутренний размер = 10 х 8 мм  10 колец диаметром 2,1 см, внутренний размер = 14 х 11 мм.
Игла для выворачивания руликов, поясов, кулисок, 17.5×2.2 см	Создание слаймов	75	https://www.sima-land.ru/1215421/igla-dlya-vyvorachivaniya-rulikov-poyasov-kulisok-17-5-2-2-cm/	Такая игла незаменима для работы с мелкими деталями, такими как рулики, пояса, кулиски и многое другое. С ней вы легко выверните изделие на лицевую сторону, потратив на это всего несколько секунд.  Размеры:  18 х 25,5 см. 
Набор крючков для вязания, d = 2-3,5 мм, 14 см, 4 шт, цвет разноцветный	Создание слаймов	163	https://www.sima-land.ru/6906729/nabor-kryuchkov-dlya-vyazaniya-d-2-3-5-mm-14-cm-4-sht-cvet-raznocvetnyy/	Handmade-изделия никогда не теряют своей актуальности. Вооружитесь тонким металлическим крючком и создавайте свои собственные рукодельные шедевры. Такой инструмент подойдёт для вывязывания мелких деталей и создания изящных салфеток, украшений и других декоративных элементов. Дополнительные характеристики:
Игла для поднятия петель, 15.5 см, d=3 мм, розовая, жёлтая, цена за 1 штуку	Создание слаймов	34	https://www.sima-land.ru/10858019/igla-dlya-podnyatiya-petel-15-5-cm-d-3-mm-rozovaya-zheltaya-cena-za-1-shtuku/	Представляем компактный и элегантный инструмент для ваших творческих работ — иглу, созданную для поднятия петель с максимальным комфортом. Этот аксессуар станет вашим надёжным помощником в вязании, шитье или создании уникальных изделий ручной работы. Сочетание практичности и стиля делает эту иглу идеальным выбором для мастеров любого уровня. Благодаря продуманному дизайну длиной 15,5 см и диаметром 3 мм, она удобно лежит в руке, обеспечивая точность движений даже при длительном использовании. Выбирая этот инструмент, вы получаете не только функциональное приспособление, но и источник вдохновения для воплощения ваших идей. Позвольте себе наслаждаться процессом создания с этим незаменимым помощником!
Спицы круговые, для вязания, с металлическим тросом, d=3.5 мм, 14/60 см	Создание слаймов	31	https://www.sima-land.ru/9684209/spicy-krugovye-dlya-vyazaniya-s-metallicheskim-trosom-d-3-5-mm-14-60-cm/	
Набор заглушек для спиц, d=2-3 мм, 1.1×3.5 см, 6 шт., МИКС	Создание слаймов	63	https://www.sima-land.ru/9101457/nabor-zaglushek-dlya-spic-d-2-3-mm-1-1-3-5-cm-6-sht-miks/	Наконечники для спиц нужны для того, чтобы незаконченное изделие можно было отложить в сторону, не боясь, что все петли разойдутся, и придётся начинать заново.  Накрутите на концы спиц эти нехитрые приспособления и смело отправляйтесь по своим делам.  В наборе 6 шт. 
Спица гибкая для продевания резинки / тесьмы / шнура, 58 см, розовая	Создание слаймов	79	https://www.sima-land.ru/10481421/spica-gibkaya-dlya-prodevaniya-rezinki-tesmy-shnura-58-cm-rozovaya/	Познакомьтесь с практичным решением для ваших творческих проектов — гибкой спицей, которая поможет вам легко справиться с задачами по продеванию резинок, тесьмы или шнуров. Этот инструмент станет вашим надёжным помощником в процессе создания одежды, аксессуаров или других изделий. С длиной 58 см и приятным розовым цветом, этот аксессуар сочетает в себе функциональность и эстетику. Благодаря своей гибкости он идеально подходит для работы с различными материалами, позволяя выполнять манипуляции даже в труднодоступных местах. С этой гибкой спицей вы сможете воплощать свои идеи быстрее и проще, не сталкиваясь с ограничениями. Позвольте себе наслаждаться каждым этапом вашего творческого пути!
Набор крючков для вязания, d = 7/8/9 мм, 14 см, 3 шт, цвет белый	Создание слаймов	79	https://www.sima-land.ru/2294147/nabor-kryuchkov-dlya-vyazaniya-d-7-8-9-mm-14-cm-3-sht-cvet-belyy/	Рукоделие стало настоящим трендом: вместо дизайнерских аксессуаров и предметов одежды в моду вошли вещи, созданные собственными руками. Удобные крючки сделают процесс наполнения гардероба уникальными изделиями проще.  Вооружитесь инструментами, чтобы создавать настоящие шедевры: единственные в своём роде перчатки, варежки, шапочки и многое другое станут возможны с этой небольшой принадлежностью для вязания. 
Клубочница, d = 15 × 8 см, цвет коричневый	Создание слаймов	1235	https://www.sima-land.ru/9557084/klubochnica-d-15-8-cm-cvet-korichnevyy/	
Спицы для вязания, чулочные, с тефлоновым покрытием, d=2.5 мм, 20 см, 5 шт.	Создание слаймов	112	https://www.sima-land.ru/744699/spicy-dlya-vyazaniya-chulochnye-s-teflonovym-pokrytiem-d-2-5-mm-20-cm-5-sht/	Рукоделие и handmade вещицы становится настоящим трендом: вместо аксессуаров и предметов одежды именитых домов моды пришли вещи, созданные собственными руками. Вязать и шить оригинальные предметы одежды станет проще с принадлежностями, которые вы прямо сейчас можете выбрать и заказать на нашем сайте.  Значительным подспорьем в вязании вещей на холодное время года станут спицы. Самые разные модели по привлекательным ценам вы можете выбрать и заказать на нашем сайте. 
