name	category	price	rating	url	description
Наклейка пластик объёмные "Фламинго/Павлины" МИКС 28х15 см	Принадлежности для творчества	55	4.5	https://www.sima-land.ru/7389855/nakleyka-plastik-obemnye-flamingo-pavliny-miks-28h15-cm/	
Бисер стекло 8/0 "Матовый полупрозрачный. Меланж ярко-зелёный" 10 гр	Плетение	43.4	5	https://www.sima-land.ru/7461440/biser-steklo-8-0-matovyy-poluprozrachnyy-melanzh-yarko-zelenyy-10-gr/	
Бисер стекло 6/0 - 15/0 "Ассорти радуга" d=1,5-4 мм, н-р 10гр	Плетение	24	4.5	https://www.sima-land.ru/7463307/biser-steklo-6-0-15-0-assorti-raduga-d-1-5-4-mm-n-r-10gr/	
Булавки с круглым концом, 22 мм, 20 шт, цвет чёрный	Принадлежности для шитья	19	5	https://www.sima-land.ru/7510643/bulavki-s-kruglym-koncom-22-mm-20-sht-cvet-chernyy/	Булавка — универсальный помощник в быту, при шитье и рукоделии. Она пригодится для закалывания материала, драпировки ткани, создания украшений. С ней вы можете прикрепить к одежде или домашнему текстилю мягкие аксессуары. Благодаря миниатюрным размерам изделия его легко скрыть в складках или декоративном элементе. Острый край булавки прячется в безопасную петельку, она не уколет и прослужит вам очень долго.
Бусины для творчества PVC "Ушки" цветные набор 20 шт 1х1х1 см	Принадлежности для творчества	38	5	https://www.sima-land.ru/7829740/businy-dlya-tvorchestva-pvc-ushki-cvetnye-nabor-20-sht-1h1h1-cm/	
Наклейки в рулоне «Любовь»,500 шт.,3.8×3.8 см	Флористика	94	5	https://www.sima-land.ru/7904718/nakleyki-v-rulone-lyubov-500-sht-3-8-3-8-cm/	Декоративные наклейки - это яркое и веселое решение для творчества и самовыражения. Все, что вам нужно сделать, это отклеить их и наклеить, и они придадут вашим предметам новый стиль и характер. Преимущества:
Бумага для скрапбукинга "Цыплята на траве" плотность 180 гр 30,5х32 см	Скрапбукинг	9.5	4	https://www.sima-land.ru/7908009/bumaga-dlya-skrapbukinga-cyplyata-na-trave-plotnost-180-gr-30-5h32-cm/	
Бусины для творчества пластик "Кабошон с кантом" набор 10 шт МИКС 1,2х1,6х2 см	Принадлежности для творчества	108	4.8	https://www.sima-land.ru/9285319/businy-dlya-tvorchestva-plastik-kaboshon-s-kantom-nabor-10-sht-miks-1-2h1-6h2-cm/	
Наклейки для творчества "Подводный мир" тиснение серебро набор 48 шт 9х7х0,8 см	Принадлежности для творчества	57	5	https://www.sima-land.ru/9494209/nakleyki-dlya-tvorchestva-podvodnyy-mir-tisnenie-serebro-nabor-48-sht-9h7h0-8-cm/	
Наклейка-игра «Одень куклу. Профессии», для скрапбукинга, творчества, пластик, 15×20 см	Принадлежности для творчества	22.2	5	https://www.sima-land.ru/9540266/nakleyka-igra-oden-kuklu-professii-dlya-skrapbukinga-tvorchestva-plastik-15-20-cm/	
Фигурка для флорариума полистоун «Телескоп», 1.7×2.2 см	Ёмкости для растений и аксессуары	20.3	4.8	https://www.sima-land.ru/9544599/figurka-dlya-florariuma-polistoun-teleskop-1-7-2-2-cm/	
Миниатюра кукольная «Довольный дракон», набор 2 шт., размер 1 шт. — 2,6 × 2,2 см	Создание игрушек и кукол	27.2	5	https://www.sima-land.ru/9557077/miniatyura-kukolnaya-dovolnyy-drakon-nabor-2-sht-razmer-1-sht-2-6-2-2-cm/	
Набор термоаппликаций «Нежность», 3 шт.	Декоративные элементы для одежды	66	5	https://www.sima-land.ru/9570364/nabor-termoapplikaciy-nezhnost-3-sht/	Создайте атмосферу нежности и романтики с помощью набора текстильных термонаклеек, которые превратят ваши вещи в маленькие произведения искусства. Этот комплект из трех разноцветных элементов станет идеальным решением для тех, кто хочет добавить мягкости и женственности своему гардеробу. Каждая наклейка имеет уникальный дизайн и размер: 4,5×5 см, 5,7×8,5 см и 6,8×9,8 см, что позволяет создавать интересные композиции на различной основе. Благодаря технологии термопереноса они легко фиксируются на ткани, не требуя специальных инструментов или профессиональных навыков. Тематика «цветочно-растительная» делает этот набор универсальным выбором для декора одежды, аксессуаров или домашнего текстиля. С этим набором термонаклеек каждая ваша вещь может стать отражением вашего внутреннего мира и источника вдохновения. Дайте волю своей фантазии и создавайте!
Бабочки картон "Космос" набор 12 шт h=4-10 см	Принадлежности для творчества	26.4	5	https://www.sima-land.ru/9668915/babochki-karton-kosmos-nabor-12-sht-h-4-10-cm/	
Набор наклеек для декора «Арт Узор. Бабочки газетные», 12 шт., двойные крылья, картон, для скрапбукинга, творчества, h=4-10 см	Принадлежности для творчества	34.8	5	https://www.sima-land.ru/9668917/nabor-nakleek-dlya-dekora-art-uzor-babochki-gazetnye-12-sht-dvoynye-krylya-karton-dlya-skrapbukinga-tvorchestva-h-4-10-cm/	
Трафарет пластик "Лиственная звезда" 13х14 см	Принадлежности для творчества	25.3	5	https://www.sima-land.ru/9669631/trafaret-plastik-listvennaya-zvezda-13h14-cm/	
Набор для создания открытки из фетра «Котик со сладостями»	Аппликации	64	5	https://www.sima-land.ru/9690207/nabor-dlya-sozdaniya-otkrytki-iz-fetra-kotik-so-sladostyami/	Детям нравится создавать поделки из самых невероятных материалов. Оригинальный набор для создания фетровой открытки по-настоящему увлечёт ребёнка и станет удачным подарком для талантливого малыша! Теперь вам не нужно вырезать детали вручную, просто отделите защитную пленку и приклейте их на нужное место. Чем полезно? Набор развивает мелкую моторику ручек малыша, координацию движений, тренирует усидчивость, аккуратность, внимательность, помогает формировать зрительное восприятие и художественный вкус. Наслаждайтесь творчеством вместе с детьми!
Стразы для декора, круглые, разноразмерные, чёрные	Маникюр и педикюр	20	4.7	https://www.sima-land.ru/9703276/strazy-dlya-dekora-kruglye-raznorazmernye-chernye/	Разноразмерный стразы для декора ногтей, выглядят не менее эффектно, чем настоящие драгоценные камни — притом они просты в использовании. Размер страз от 0,3 мм до 1 мм. Стразы станут прекрасным дополнением лунного маникюра, френча, декора с рисунком или однотонного покрытия.
Миниатюра кукольная «Хаски»	Создание игрушек и кукол	86	4.8	https://www.sima-land.ru/9716251/miniatyura-kukolnaya-haski/	
Скетчбук А6, 60 листов 190 г/м2 «Серый»	Бумага и бумажная продукция	59	5	https://www.sima-land.ru/9762584/sketchbuk-a6-60-listov-190-g-m2-seryy/	
Вышивка крестиком на Новый год. Набор для вышивания носка «Дед Мороз с игрушками»	Вышивка	79	4.9	https://www.sima-land.ru/9807420/vyshivka-krestikom-na-novyy-god-nabor-dlya-vyshivaniya-noska-ded-moroz-s-igrushkami/	Новый год - самый волшебный праздник и замечательный повод освоить новое хобби! Вышивка с красивым узором и цветной схемой — то, что нужно ребёнку. С таким набором даже новичок сможет создать сказочную картину, наполненную атмосферой праздника. В процессе создания вышивки у ребёнка развиваются важные качества, которые пригодятся ему в будущем: усидчивость, аккуратность, внимательность. Кроме того, время, проведённое с канвой, благотворно скажется на его эмоциональном состоянии, мелкой моторике рук. Готовая вышивка станет замечательным атрибутом семейного праздника или оригинальным подарком.
Вышивка крестиком на новый год «Снегирь в венке», 25 х 20 см, набор для творчества	Вышивка	29	4.8	https://www.sima-land.ru/9807429/vyshivka-krestikom-na-novyy-god-snegir-v-venke-25-h-20-cm-nabor-dlya-tvorchestva/	Новый год - самый волшебный праздник и замечательный повод освоить новое хобби! Небольшая вышивка с простым узором и цветной схемой — то, что нужно малышу. С таким набором даже новичок сможет создать сказочную картину, наполненную атмосферой праздника. В процессе создания вышивки у ребёнка развиваются важные качества, которые пригодятся ему в будущем: усидчивость, аккуратность, внимательность. Кроме того, время, проведённое с канвой, благотворно скажется на его эмоциональном состоянии, мелкой моторике рук. Готовая вышивка станет замечательным атрибутом семейного праздника или оригинальным подарком.
Вышивка крестиком для детей на пластиковой канве «Волшебство», набор для творчества	Вышивка	83	4.5	https://www.sima-land.ru/9824268/vyshivka-krestikom-dlya-detey-na-plastikovoy-kanve-volshebstvo-nabor-dlya-tvorchestva/	Вышивка — творческое занятие, которое направлено на развитие мелкой моторики у детей. Ребёнку предстоит продевать нити через специальные отверстия на пластиковой канве. Делать это предстоит с помощью безопасной пластиковой иглы из комплекта и в определенной последовательности, чтобы соблюсти рисунок и украсить персонажа. В наборе:
Стразы пришивные «Шатон», круглые, в цапах, d=10 мм, 20 шт., зелёные	Принадлежности для творчества	34	5	https://www.sima-land.ru/9855197/strazy-prishivnye-shaton-kruglye-v-capah-d-10-mm-20-sht-zelenye/	Пластиковые стразы в оправе имеют яркий, сияющий блеск и прекрасно отражают падающий свет разноцветными бликами. Выполнены на современном оборудовании с безупречным качеством, имеют идеально ровную форму и огранку. Мятый опал подходит для украшения и декорирования изделий любых цветов и оттенков. Стразы в оправе являются практичным материалом для рукоделия и изготовления бижутерии.
Подставки для украшений с крышкой QF «Шкатулка» антиокислительная 10 мест, 12.8×6.5×2.1 см, прозрачная	Торговое оборудование	43	4.9	https://www.sima-land.ru/9863816/podstavki-dlya-ukrasheniy-s-kryshkoy-qf-shkatulka-antiokislitelnaya-10-mest-12-8-6-5-2-1-cm-prozrachnaya/	Шкатулка для украшений из пластика — это легкий и практичный органайзер для хранения и демонстрации аксессуаров, подходящий как для дома, так и для путешествий. Прочный пластик надежно защищает украшения от повреждений, а внутренние отделения позволяют удобно разместить кольца, серьги, цепочки и браслеты, сохраняя их в порядке. Компактный и функциональный дизайн делает шкатулку удобной для транспортировки, что позволяет легко брать её с собой в поездки. Этот стильный органайзер обеспечит вашим украшениям идеальное хранение и порядок в любом месте.
Наклейка пластик стразы "Треугольный градиент" МИКС 24,6х10 см	Принадлежности для творчества	69	5	https://www.sima-land.ru/9880224/nakleyka-plastik-strazy-treugolnyy-gradient-miks-24-6h10-cm/	
Лента декоративная, репсовая, ажурная, 25 мм × 9,1 ± 0,5 м, цвет малиновый	Ленты	104	4.9	https://www.sima-land.ru/9887519/lenta-dekorativnaya-repsovaya-azhurnaya-25-mm-9-1-0-5-m-cvet-malinovyy/	
Кружево реснички, 280 мм × 3 ± 0,5 м, цвет белый	Отделочные материалы	115	5	https://www.sima-land.ru/9911978/kruzhevo-resnichki-280-mm-3-0-5-m-cvet-belyy/	
Подвеска из камня «Опал», в проволоке	Фурнитура для бижутерии	99	4.8	https://www.sima-land.ru/9923007/podveska-iz-kamnya-opal-v-provoloke/	
Стакан непроливайка одинарный 210мл Calligrata "Пушистик", с рисунком	Принадлежности для рисования	12.9	5	https://www.sima-land.ru/10085265/stakan-neprolivayka-odinarnyy-210ml-calligrata-pushistik-s-risunkom/	Стакан-непроливайка Calligrata из прочного пластика с оригинальным дизайном сделает процесс рисования более увлекательным Специальная форма крышки стакана исключает возможность вытекания воды. Линия на прозрачном корпусе указывает на максимально возможный уровень наполнения. Выполнен из прочного пластика. Имеются специальные углубления на крышке для размещения кисточек. Полный объем - 210 мл. Объем до уровня - 75 мл. Оригинальный дизайн сделает процесс рисования еще более увлекательным Характеристики: Все без исключения дети и взрослые любят рисовать! Покупайте стакан-непроливайку Calligrata в нашем интернет-магазине!
Топпер для торта «Девушка с бабочками», набор 7 шт., розовый	Оформление и организация праздника	39	5	https://www.sima-land.ru/10092482/topper-dlya-torta-devushka-s-babochkami-nabor-7-sht-rozovyy/	Набор топперов «Девушка с бабочками» — идеальный выбор для любого праздника! В этот набор входят 7 топперов, которые идеально подходят для украшения тортов, десертов и букетов цветов. Изделия изготовлены из бумаги и пластика. Их можно использовать в качестве декора для самых разнообразных праздников. Высота держателей — 12 см и 21 см, это позволяет размещать топперы на тортах разного размера. Розовый цвет и нежный дизайн с бабочками создают атмосферу лёгкости и романтики. Преимущества использования топперов Применение топперов Топперы способны создать неповторимую атмосферу на любом празднике. Они идеально подходят для украшения тортов, капкейков и других сладких угощений.
Наклейки антискользящие, для линеек, силиконовые, 1,9 см, 8 шт	Принадлежности для кроя	24.4	5	https://www.sima-land.ru/10092636/nakleyki-antiskolzyaschie-dlya-lineek-silikonovye-1-9-cm-8-sht/	
Топпер для торта «С днём рождения», золотой с белым	Оформление и организация праздника	19	0	https://www.sima-land.ru/10133514/topper-dlya-torta-s-dnem-rozhdeniya-zolotoy-s-belym/	
Вспарыватель с колпачком, 7,9 см, цвет МИКС	Принадлежности для шитья	60	0	https://www.sima-land.ru/10198268/vsparyvatel-s-kolpachkom-7-9-cm-cvet-miks/	Быстро и аккуратно разделить шов, не повредив ткань и пальцы, поможет распарыватель. Острый край одним движением срежет нить, а маленький шарик и удобная ручка сделают процедуру безопасной.
Аппликация для одежды «Бабочка», текстильная, 5×4 см, 10 шт., красная, белая	Декоративные элементы для одежды	79	5	https://www.sima-land.ru/10240127/applikaciya-dlya-odezhdy-babochka-tekstilnaya-5-4-cm-10-sht-krasnaya-belaya/	Превратите обычные вещи в уникальные произведения искусства с помощью этих ярких и стильных аппликаций. Десять текстильных бабочек, выполненных из высококачественного полиэстера, станут идеальным решением для декора одежды, аксессуаров или домашнего текстиля. Каждая бабочка размером 5×4 см — это гармоничное сочетание элегантности и практичности. Яркие красные акценты и благородная белая основа добавляют динамику и свежесть любому изделию, делая его центром внимания. Благодаря небольшому размеру эти аппликации можно использовать на самых разных поверхностях: от детской одежды до сумок и скрапбукинг-проектов. Материал устойчив к стирке, сохраняя форму и цвет даже после интенсивного использования. С этими аппликациями вы сможете легко добавить индивидуальности своим творческим проектам. Будь то обновление гардероба или создание подарков своими руками, бабочки станут вашим надёжным помощником в воплощении самых смелых идей. Дайте волю фантазии и создайте нечто особенное!
Аппликация для одежды «Цветочек», текстильная, 2.5×3.5 см, 10 шт., розовая, зелёная	Декоративные элементы для одежды	45	5	https://www.sima-land.ru/10240293/applikaciya-dlya-odezhdy-cvetochek-tekstilnaya-2-5-3-5-cm-10-sht-rozovaya-zelenaya/	Хотите добавить в свой гардероб немного природного очарования? Обратите внимание на милые цветочные аппликации от Арт Узор. В наборе вы найдёте 10 небольших элементов (2.5×3.5 см), где воздушные розовые лепестки сочетаются с зеленью листочков. Такое сочетание идеально подойдёт для создания лёгких и солнечных летних образов. Аппликации выполнены из качественных материалов, которые не только сохраняют свои качества, но и радуют четкими контурами и устойчивостью к повседневным нагрузкам. Благодаря насыщенной цветовой гамме, эти цветы напоминают о первых весенних бутонах, даря вещам тепло и уют. С этими аппликациями вы сможете быстро преобразить сарафан девочки, добавить романтичности льняной сумке или создать уникальный дизайн шортам. Арт Узор предлагает вам не просто набор декоративных элементов, а возможность проявить фантазию и создавать тёплые, душевные образы, которые будут радовать вас каждый день.
Трафарет пластик "Дерево" 15х15 см	Принадлежности для творчества	24.7	0	https://www.sima-land.ru/10249811/trafaret-plastik-derevo-15h15-cm/	
Наклейка пластик "Зверята" МИКС 9,5х17,5 см	Принадлежности для творчества	36.3	5	https://www.sima-land.ru/10277302/nakleyka-plastik-zveryata-miks-9-5h17-5-cm/	
Проволока для изготовления искусственных цветов "Кофе" обмотка бумага 60 см сечение 0,3 мм   1042482	Принадлежности для творчества	1.27	5	https://www.sima-land.ru/10424822/provoloka-dlya-izgotovleniya-iskusstvennyh-cvetov-kofe-obmotka-bumaga-60-cm-sechenie-0-3-mm-1042482/	
