name	category	price	rating	url	description
Сердечки декоративные, набор 12 шт., размер 1 шт: 6,5×6 см, цвет красный	Принадлежности для творчества	109	5	https://www.sima-land.ru/3944548/serdechki-dekorativnye-nabor-12-sht-razmer-1-sht-6-5-6-cm-cvet-krasnyy/	
Гуашь художественная банка 20 мл, Гамма, белила цинковые, 0.20.В020.0011	Принадлежности для рисования	80	5	https://www.sima-land.ru/4047861/guash-hudozhestvennaya-banka-20-ml-gamma-belila-cinkovye-0-20-v020-0011/	Художественная гуашь идеальна для живописных, декоративных работ и графики. Она наносится практически на все материалы, имеющие ровную поверхность, но лучше всего на бумагу, картон и грунтованный холст. При высыхании приобретают матовую, бархатистую поверхность, легко размываются водой. Гуашь хорошо набирается на кисть, обладает замечательной разносимостью, хорошо сохнет.
Набор для раскопок «Сокровища карибского моря»	Наборы для творчества	229	4.8	https://www.sima-land.ru/4064771/nabor-dlya-raskopok-sokrovischa-karibskogo-morya/	Набор для раскопок позволит ребёнку почувствовать себя настоящим археологом, который разыскивает древние сокровища с помощью специальных инструментов. Как гласит легенда: Много лет пираты грабили судна разных стран. Собирали с них всё золото и закапывали по всему миру. Теперь пиратов осталось совсем немного. А вот их клады так и остались лежать на разных островах и континентах. Этапы раскопок В наборе есть: Рекомендовано для детей от 5 лет.
Светоотражающий элемент «Пешеходный переход», двусторонний, 4,8 × 4,8 см, цвет синий	Декоративные элементы для одежды	29	4.9	https://www.sima-land.ru/4105948/svetootrazhayuschiy-element-peshehodnyy-perehod-dvustoronniy-4-8-4-8-cm-cvet-siniy/	Безопасность ребёнка на улице — первоочередная задача для всех заботливых родителей, особенно вблизи проезжей части. Красивый светоотражающий брелок выделит кроху из толпы прохожих, и водители издалека увидят малютку. Изделие легко можно разместить на элементах одежды, рюкзаке или школьном портфеле, а также транспортном средстве, например велосипеде или самокате.
Наклейка на авто, следы от пуль, набор 18 шт.	Внешние дополнительные элементы	49	4.9	https://www.sima-land.ru/4331035/nakleyka-na-avto-sledy-ot-pul-nabor-18-sht/	Наклейки для автомобиля - это недорогой и простой способ добавить вашему автомобилю индивидуальности. В отличие от перекраски и аэрографии такой способ не требует специальных навыков и много времени.
Резинка ажурная бельевая, 14 мм, 10±1 м, серая	Отделочные материалы	95	5	https://www.sima-land.ru/4440485/rezinka-azhurnaya-belevaya-14-mm-10-1-m-seraya/	Ажурная резинка — это тонкая и эластичная лента с красивым плетением, которая придаст изделиям изысканный вид и яркий акцент. Преимуществом ажурной резинки является прочность, способность легко растягиваться и обеспечивать комфортную посадку. Применяется для окантовки трусиков по верхнему срезу и вырезу ног, края чашек бюстгальтера, а также для отделки краёв юбок, блузок, платьев, для создания декоративных элементов на рукавах или воротниках, для декорирования штор, покрывал, подушек или скатертей. Существует множество вариантов ажурного плетения, позволяющих выбрать резинку, идеально подходящую по стилю.
Сухой колос пшеницы, набор 50 шт., цвет розовый	Цветы, флористика, декор	299	4.9	https://www.sima-land.ru/4447389/suhoy-kolos-pshenicy-nabor-50-sht-cvet-rozovyy/	Сухоцвет «Розовый колос пшеницы» станет прекрасным дополнением для любых флористических композиций и украшений интерьера. Сочетание натурального материала и нежного яркого цвета делает сухоцвет универсальным элементом для любого интерьера. Натуральные сухоцветы сохраняют свою красоту и форму надолго, добавляя естественный и элегантный акцент в любое пространство. Особенности Сухой колос отлично подходят для декора интерьера, создания букетов и композиций, использования в праздничных украшениях. Они также могут быть использованы в различных поделках и декоративных проектах.
Баночка для скрапбукинга "Шарик" 90 мл МИКС 7х5х5 см	Принадлежности для творчества	43.9	5	https://www.sima-land.ru/4467043/banochka-dlya-skrapbukinga-sharik-90-ml-miks-7h5h5-cm/	
Бабочка для декора и флористики, на прищепке, пластиковая, сиреневый, МИКС, 1 шт., 8×5×1 см	Упаковка для цветов	49	1	https://www.sima-land.ru/4569771/babochka-dlya-dekora-i-floristiki-na-prischepke-plastikovaya-sirenevyy-miks-1-sht-8-5-1-cm/	Декор на прищепке бабочка прекрасно подходят для украшения  флористических композиций и  декора интерьера и других творческих поделок. Способ применения: с помощью прищепки, на которую приклеены бабочки, их удобно использовать. Запаситесь фантазией и необходимыми материалами и создавайте красоту для своего загородного участка или флористических композиций.
Кисть для рисования, Синтетика Круглая № 8 (диаметр обоймы 8 мм; длина волоса 26 мм), деревянная ручка, Calligrata	Принадлежности для рисования	94	4.9	https://www.sima-land.ru/4670555/kist-dlya-risovaniya-sintetika-kruglaya-8-diametr-oboymy-8-mm-dlina-volosa-26-mm-derevyannaya-ruchka-calligrata/	Кисть из синтетического ворса - являются аналогом кистей из натурального колонка и белки по параметрам жёсткости и эластичности.  Рыжий ворс - средняя жесткость кистей и средняя толщина ворса. Рыжая синтетика по жесткости чуть мягче щетины. Синтетический волос имеет гладкую структуру и обладает капиллярным эффектом, что позволяет использовать такие кисти при работе с акварелью, гуашью, темперой, акрилом и маслом. Кисть представлена с цельнометаллической никелированной бесшовной обоймой, обеспечивающей надёжное соединение ручки и волосяного пучка. Кисть полноразмерная , соответствует российскому размеру. Производитель рекомендует перед началом работы с кистью промыть рабочую часть под проточной водой. И удалить подпушь, если таковая имеется на выходе (ТУ небольшой выход волоса допустим).
Рама для картин (зеркал) 20 х 20 х 4 см, дерево "Версаль", золотая	Товары для художников	279	4.4	https://www.sima-land.ru/4710500/rama-dlya-kartin-zerkal-20-h-20-h-4-cm-derevo-versal-zolotaya/	
Картина по номерам для детей «Волшебная лама», 15 х 15 см	Картины по номерам	316	5	https://www.sima-land.ru/4719046/kartina-po-nomeram-dlya-detey-volshebnaya-lama-15-h-15-cm/	Подарите маленькому художнику картину по номерам, и через пару мгновений он создаст шедевр! Как раскрасить картину по номерам Готовая картина украсит детскую комнату или станет оригинальным подарком близкому человеку.
Сухоцвет «Камыш», набор 15 шт., цвет бежевый	Цветы, флористика, декор	599	4.9	https://www.sima-land.ru/4797384/suhocvet-kamysh-nabor-15-sht-cvet-bezhevyy/	Сухоцветы являются натуральным и экологичным декором, который можно применить для создания различных поделок. Украсьте квартиру композицией из сухоцветов или устройте фотосессию с разнообразным реквизитом. Сферы использования сухоцветов Особенности сухоцветов
Алмазная мозаика с частичным заполнением на холсте «Белый лебедь», 30 х 40 см	Алмазная мозаика	459	5	https://www.sima-land.ru/4967870/almaznaya-mozaika-s-chastichnym-zapolneniem-na-holste-belyy-lebed-30-h-40-cm/	Этот набор позволит создать настоящий шедевр своими руками! Разложите кристаллики с помощью карандаша по указанной схеме, заполнив полотно. Тканевая основа с точечным клеевым покрытием будет надёжно удерживать стразы. На картине уже обозначены необходимые оттенки, а цветовая таблица расположена рядом с рабочей областью холста. Часть изображения предстоит заполнить стразами, другая часть напечатана на холсте-основе. Поэтому набор подойдёт для тех, кто впервые пробует свои силы в этой технике или любит быстро добиваться результата. А для того чтобы натянуть готовую картину на подрамник или вставить в раму, у холста предусмотрена дополнительная тканевая область. Сияющее полотно украсит любой интерьер и станет отличным подарком для близких.
Раскраска - гигант «Мир динозавров», 59 × 84 см	Детские книги	75	5	https://www.sima-land.ru/5045014/raskraska-gigant-mir-dinozavrov-59-84-cm/	Раскраска гигант «Мир динозавров» — это отличная возможность для детей весело провести время, развивая моторику и фантазию. Особенности и преимущества Раскраска стимулирует интерес к творчеству и позволяет детям погружаться в игровой процесс на долгие часы. Рекомендовано для детей старше 3 лет.
Картина по номерам для детей «Мишутка», 20 х 28,5 см	Картины по номерам	290	5	https://www.sima-land.ru/5053368/kartina-po-nomeram-dlya-detey-mishutka-20-h-28-5-cm/	Подарите маленькому художнику картину по номерам, и через пару мгновений он создаст шедевр! Как раскрасить картину по номерам Готовая картина украсит детскую комнату или станет оригинальным подарком близкому человеку.
Бумага для пастели А4, deVENTE, набор 20 листов, 120 г/м2, чёрная, в пакете	Бумага и бумажная продукция	139	5	https://www.sima-land.ru/5058740/bumaga-dlya-pasteli-a4-devente-nabor-20-listov-120-g-m2-chernaya-v-pakete/	Бумага для пастели A4 (210x297 мм) "deVENTE" черная, 120 г/м2, 20 листов, в пластиковом пакете с европодвесом
Органайзер для хранения мелочей, 12 ячеек, 13×5.3×1.3 см, прозрачный	Косметички и органайзеры	47.1	4.9	https://www.sima-land.ru/5070008/organayzer-dlya-hraneniya-melochey-12-yacheek-13-5-3-1-3-cm-prozrachnyy/	Этот компактный и функциональный органайзер с 12 ячейками станет вашим идеальным помощником в хранении мелких предметов. Прозрачные стенки позволяют легко видеть содержимое, а индивидуальные крышки на каждой ячейке гарантируют сохранность материалов и предотвращают их смешивание. Легкость и компактность делают его отличным выбором для мастеров маникюра, рукодельниц, визажистов и даже детей. Оцените удобство и надежность этого органайзера для хранения мелочей и наслаждайтесь порядком в ваших принадлежностях каждый день! Характеристики: 12 ячеек, прозрачный пластик, размеры: 13 х 5,3 х 1,3 см.
Фломастеры 6 цветов в блистере, вентилируемый колпачок	Принадлежности для рисования	130	4	https://www.sima-land.ru/5087812/flomastery-6-cvetov-v-blistere-ventiliruemyy-kolpachok/	Фломастерами легко наполнять цветом картинки в раскраске и дать волю воображению и создать сочный рисунок, искрящийся красками. Настолько удобны в использовании, что с ними справляется даже самый юный художник. Рекомендованы для детей от 3-х лет. Начните сказочное путешествие в безграничный мир фантазии вместе с фломастерами! Спешите приобрести все необходимое для детского творчества в нашем интернет-магазине!
Подрамник для холста Calligrata, 1,8 x 60 x 90 см, ширина рамы 36 мм, сосна	Товары для художников	535	5	https://www.sima-land.ru/5186293/podramnik-dlya-holsta-calligrata-1-8-x-60-x-90-cm-shirina-ramy-36-mm-sosna/	
Резинка для бретелей, блестящая, 15 мм, 10±0.5 м, чёрная	Отделочные материалы	260	4.7	https://www.sima-land.ru/5217139/rezinka-dlya-breteley-blestyaschaya-15-mm-10-0-5-m-chernaya/	Бретельная резинка — это упругая и эластичная лента, предназначенная для комфортного и надёжного крепления бретелей на нижнем белье или одежде. С лицевой стороны эта лента гладкая и блестящая, с изнаночной — более жёсткая и эластичная. Основной задачей резинки является обеспечение дополнительной поддержки груди, а также комфортная носка даже при длительном использовании. Резинка плотно фиксируется, предотвращая скольжение и спадание, подходит для всех типов бретелей. Для комфорта и здоровья следует выбирать ленту, которая соответствует размеру бюстгальтера: чем он больше, тем шире лента.
Жемчуг на леске, 3/8 мм, 9±0.5 м, серый	Отделочные материалы	209	4.9	https://www.sima-land.ru/5235806/zhemchug-na-leske-3-8-mm-9-0-5-m-seryy/	Представляем вашему вниманию элемент декора, который станет основой для создания стильных и современных решений в оформлении. Эти жемчужины на леске привлекают своей универсальностью и блестящим серым цветом, который легко впишется в любой дизайн. Будь то украшение интерьера, создание аксессуаров или подготовка к праздничным мероприятиям — эти бусины станут идеальным выбором для воплощения ваших идей. Благодаря двум размерам жемчужин — 3 мм и 8 мм — вы сможете экспериментировать с текстурами и формами, создавая уникальные композиции. Длина лески в 9±0.5 метров предоставляет достаточно материала для реализации даже самых масштабных проектов. Легкий пластик, из которого изготовлены бусины, гарантирует их долговечность и удобство использования, сохраняя безупречный внешний вид на протяжении длительного времени. Эти жемчужины станут вашим надежным помощником в мире декора и рукоделия. Они помогут вам создать атмосферу уюта и стиля, добавят изысканности вашим украшениям и подарят возможность выразить свою индивидуальность через дизайн. Дайте волю фантазии — и пусть каждая деталь станет частью чего-то особенного!
Акварель медовая 24 цвета, ЗХК "Цветик", без кисти, зеленый пластиковый футляр, 27421677	Принадлежности для рисования	206	4.9	https://www.sima-land.ru/5388236/akvarel-medovaya-24-cveta-zhk-cvetik-bez-kisti-zelenyy-plastikovyy-futlyar-27421677/	Акварельные медовые краски "Цветик" разрабатывались с учетом высоких требований к качеству и безопасности специально для детского художественного творчества дошкольников. Краски легко берутся на кисть, смешиваются и разносятся по бумаге. Рисунок остается ярким даже после высыхания. Крышку пластиковой упаковки можно использовать в качестве палитры. Краски безопасны при попадании на кожу ребенка, легко отстирываются и смываются с любых поверхностей. Изготовлены из природных компонентов, поэтому совершенно безопасны для малышей. Акварель - водорастворимая краска, поэтому высыхание (пузырьки, трещины) краски в кювете - не считается браком
Набор для шитья. Кукла с личиком и волосами, 30 см	Шитьё	269	4.8	https://www.sima-land.ru/5406052/nabor-dlya-shitya-kukla-s-lichikom-i-volosami-30-cm/	С нашим набором для творчества вы легко создадите красивую и уникальную игрушку. Особенности набора: Чем полезно? Набор развивает мелкую моторику рук, координацию движений, тренирует усидчивость, аккуратность, внимательность, помогает формировать зрительное восприятие и художественный вкус. Желаем вам приятных минут творчества!
Часы настенные интерьерные большие, 3d «Давис», плавный ход, d-45 см	Часы	188	4.6	https://www.sima-land.ru/5451323/chasy-nastennye-interernye-bolshie-3d-davis-plavnyy-hod-d-45-cm/	Настенные часы с римскими цифрами дополнят декор и интерьер вашего дома и станут отличным подарком близким людям. Стильные и красивые часы на стену с бесшумным кварцевым механизмом будут украшением любой комнаты: гостиной, спальни, зала или офиса. Они работают на батарейках, имеют регулируемые размеры циферблата и 3д эффект благодаря вспененной основе. Клеящий слой позволяет разместить часы на различные поверхности: любые виды обоев, окрашенные, деревянные, пластиковые, керамические или металлические. Декоративные часы дополнят квартиры или дачу в стиле лофт или минимализм. Оригинальные часы в стиле лофт станут отличным подарком женщине, девочке, подростку, мужчине, папе, коллеге на Новый год, Рождество, 8 марта, юбилей, День Рождения или свадьбу. Размеры стрелок Типоразмер батареек АА.
