name	category	price	url	description
Набор крючков для вязания, d = 1-3 мм, 13 см, 5 шт	Создание слаймов	129	https://www.sima-land.ru/1276032/nabor-kryuchkov-dlya-vyazaniya-d-1-3-mm-13-cm-5-sht/	Рукоделие стало настоящим трендом: вместо дизайнерских аксессуаров и предметов одежды в моду вошли вещи, созданные собственными руками. Удобные крючки сделают процесс наполнения гардероба уникальными изделиями проще. Вооружитесь инструментами, чтобы создавать настоящие шедевры: единственные в своём роде перчатки, варежки, шапочки и многое другое станут возможны с этой небольшой принадлежностью для вязания. Дополнительные характеристики:
Пряжа для вязания спицами, крючком «ПНК Кирова. Ирис», 150 м/25 г, 100% мерсеризованный хлопок , цвет 0101	Создание слаймов	179	https://www.sima-land.ru/1173477/pryazha-dlya-vyazaniya-spicami-kryuchkom-pnk-kirova-iris-150-m-25-g-100-merserizovannyy-hlopok-cvet-0101/	Уникальные пряжа для вязания спицами, крючком «ПНК Кирова. Ирис», 150 м/25 г, 100% мерсеризованный хлопок , цвет 0101 из 100% мерсеризованного хлопка. Он отличается от обычного особым способом обработки. Благодаря этому волокно обретает высокую прочность, устойчивость к истиранию и мягкость. Вязаное полотно получается ровным, с лёгким глянцевым блеском и отлично подходит для жаркой летней погоды. Многие рукодельницы вяжут как спицами, так и крючком, ведь в работе нить приятная и послушная. Хотите верхний трикотаж, хотите ажурные узоры, сетки, салфетки, занавески, скатерти и даже покрывала. А так как она достаточно тонкая, то и машинное вязание вам будет по плечу. Линейная плотность /структура нити:167/2 сложения.
Органайзер для хранения спиц, 41 × 6 × 3 см, цвет МИКС	Создание слаймов	219	https://www.sima-land.ru/3623361/organayzer-dlya-hraneniya-spic-41-6-3-cm-cvet-miks/	
Крючок для вязания, d = 10 мм, 15 см, цвет белый/красный	Создание слаймов	42	https://www.sima-land.ru/2610006/kryuchok-dlya-vyazaniya-d-10-mm-15-cm-cvet-belyy-krasnyy/	Пластиковые крючки лёгкие, идеально подходят для вязания изделий из лёгкой пряжи. Вооружитесь инструментом и создавайте свои собственные рукодельные шедевры. Это может быть целый свитер, кофта или просто декоративная салфетка, но всё это будет выполнено в вашем неповторимом стиле. 
Маркеры для петель «Ромашка», d=12 мм, 5 шт., цвет белый, золотой, жёлтый	Создание слаймов	151	https://www.sima-land.ru/10534459/markery-dlya-petel-romashka-d-12-mm-5-sht-cvet-belyy-zolotoy-zheltyy/	Позвольте украсить ваше рукоделие не только созданием прекрасных изделий, но и процессом, который станет ещё более приятным с маркерами для петель «Ромашка». Эти изысканные аксессуары превратят любую работу в настоящее удовольствие. Каждый набор состоит из 5 стильных маркеров диаметром 12 мм, которые органично дополнят ваши инструменты. Благодаря уникальному дизайну, напоминающему очаровательные ромашки, они станут не просто функциональными помощниками, а настоящим украшением вашего рабочего пространства. С такими маркерами ваше творчество будет не только эффективным, но и вдохновляющим. Пусть каждый проект становится особенным с этими маленькими, но значимыми помощниками!
Машина для вязания «Вяжу как мама», с аксессуарами	Создание слаймов	1499	https://www.sima-land.ru/4383029/mashina-dlya-vyazaniya-vyazhu-kak-mama-s-aksessuarami/	В машину для вязания встроен ручной механизм. Как работает
Щётка для удаления катышков, двусторонняя, 10×5.5×0.8 см, бежевая	Создание слаймов	115	https://www.sima-land.ru/7006138/schetka-dlya-udaleniya-katyshkov-dvustoronnyaya-10-5-5-0-8-cm-bezhevaya/	Почистить вещи от катышков и дать новую жизнь старой одежде поможет специальная щётка. Она бережно удаляет всё лишнее с изделия и не портит материал. Приспособление не требует особого ухода и прослужит вам очень долго. Необходимо приложить щётку к ткани под углом 45 градусов, и, аккуратно надавливая, провести вдоль поверхности. Не подходит для работы с шёлковой и атласной тканью.
Набор для вязания. Амигуруми: мягкая игрушка своими руками «Жирафик Мэлани», 41 см	Создание слаймов	407	https://www.sima-land.ru/2724097/nabor-dlya-vyazaniya-amigurumi-myagkaya-igrushka-svoimi-rukami-zhirafik-melani-41-cm/	С нашим набором для творчества вы легко создадите красивую и уникальную игрушку. Особенности набора: Развивайте навыки вязания крючком и радуйте близких оригинальными подарками ручной работы. Желаем вам приятных минут творчества!
Набор вспомогательных спиц для вязания, d=3/4/5 мм, 3 шт., МИКС	Создание слаймов	14	https://www.sima-land.ru/1053267/nabor-vspomogatelnyh-spic-dlya-vyazaniya-d-3-4-5-mm-3-sht-miks/	Эти приспособления ― настоящая палочка-выручалочка для начинающих мастериц. Они предназначены для вязания кос, жгутов и других узоров с переплетениями. На изгибе спицы размещают петли, снятые для дальнейшего перехвата. Благодаря изгибу петли не соскальзывают во время вязания, а когда необходимо их переместить, это удобно делать всё на той же вспомогательной спице, снимая петли с любой стороны.  Обзаведитесь маленькими помощниками, и процесс вязания пойдёт намного быстрее и легче, а главное, будет доставлять одно удовольствие. 
Щётка для удаления катышков, 7.5×4.5×0.5 см, МИКС	Создание слаймов	57	https://www.sima-land.ru/1529689/schetka-dlya-udaleniya-katyshkov-7-5-4-5-0-5-cm-miks/	Почистить вещи от катышков и дать новую жизнь старой одежде поможет специальная щётка. Она бережно удаляет всё лишнее с изделия и не портит материал. Приспособление не требует особого ухода и прослужит вам очень долго. Необходимо приложить щётку к ткани под углом 45 градусов, и, аккуратно надавливая, провести вдоль поверхности. Не подходит для работы с шёлковой и атласной тканью.
Плюшевая пряжа для вязания спицами, крючком ALIZE, Velluto, 100% микрополиэстер, 68 м/100 г, (107 вишня)	Создание слаймов	269	https://www.sima-land.ru/5440052/plyushevaya-pryazha-dlya-vyazaniya-spicami-kryuchkom-alize-velluto-100-mikropoliester-68-m-100-g-107-vishnya/	
Напёрсток для вязания, d=19 мм, с двумя направляющими	Создание слаймов	40	https://www.sima-land.ru/5072987/naperstok-dlya-vyazaniya-d-19-mm-s-dvumya-napravlyayuschimi/	Пружинный напёрсток для вязания орнамента — это незаменимый атрибут для рукодельниц, любящих творить с комфортом. Он прост в применении даже для новичка. Пружинный напёрсток позволяет легко разделять нити разных цветов, рассчитан на две нити (две направляющие). Напёрсток очень лёгкий и компактный, что обеспечивает удобство в хранении, и даёт возможность взять приспособление для вязания с собой в поездку. 
Набор крючков для вязания, d = 2-4,5 мм, 14,5 см, 6 шт, цвет разноцветный	Создание слаймов	131	https://www.sima-land.ru/7575572/nabor-kryuchkov-dlya-vyazaniya-d-2-4-5-mm-14-5-cm-6-sht-cvet-raznocvetnyy/	Handmade-изделия никогда не теряют своей актуальности. Вооружитесь тонким металлическим крючком и создавайте свои собственные рукодельные шедевры. Такой инструмент подойдёт для вывязывания мелких деталей и создания изящных салфеток, украшений и других декоративных элементов. Дополнительные характеристики:
Набор крючков для вязания, d = 3-7 мм, 13,7-14 см, 5 шт , цвет разноцветный	Создание слаймов	41	https://www.sima-land.ru/7084327/nabor-kryuchkov-dlya-vyazaniya-d-3-7-mm-13-7-14-cm-5-sht-cvet-raznocvetnyy/	Handmade-изделия никогда не теряют своей актуальности. Вооружитесь тонким металлическим крючком и создавайте свои собственные рукодельные шедевры. Такой инструмент подойдёт для вывязывания мелких деталей и создания изящных салфеток, украшений и других декоративных элементов.
Спицы для вязания, прямые, d=5 мм, 35 см, 2 шт., розовые	Создание слаймов	27	https://www.sima-land.ru/9679368/spicy-dlya-vyazaniya-pryamye-d-5-mm-35-cm-2-sht-rozovye/	
Напёрсток для вязания, d=20 мм, с одной направляющей	Создание слаймов	42	https://www.sima-land.ru/10688119/naperstok-dlya-vyazaniya-d-20-mm-s-odnoy-napravlyayuschey/	Вяжете с удовольствием и хотите сделать процесс ещё комфортнее? Представляем компактный металлический аксессуар, который станет вашим надёжным помощником в рукоделии. Серебристый напёрсток для вязания диаметром 20 мм с одной направляющей создан для тех, кто ценит практичность и эргономичность. Это изделие не только защитит ваши пальцы от усталости и повреждений, но и сделает работу спицами более эффективной. Благодаря продуманному дизайну, он легко скользит по нитям, позволяя выполнять сложные манипуляции без усилий. Выбирая этот напёрсток, вы инвестируете в своё творчество и комфорт. Позвольте себе наслаждаться каждым моментом вязания, зная, что ваши инструменты работают на вас!
Набор булавок, 2,3 см, 20 шт, цвет разноцветный	Создание слаймов	1210	https://www.sima-land.ru/3780138/nabor-bulavok-2-3-cm-20-sht-cvet-raznocvetnyy-2/	Булавки используются для отметки различных участков вязания: петли реглана, места начала прибавления петель или кругового оборота. С помощью маркировочных колец и булавок можно сделать отметки на полотне: выделить нужный ряд или петлю. Длинный хвостик легко вдевается в петлю или столбик, затем фиксируется в замке, не деформирует и не растягивает вязку. Разными цветами удобно помечать участки в одном изделии: выделить спинку, пройму, полочку. Если допущена ошибка, можно за пару секунд снять и переставить булавку на другое место.
Маркеры для петель «Розы», d=10 мм, 5 шт., разноцветные	Создание слаймов	89	https://www.sima-land.ru/9556943/markery-dlya-petel-rozy-d-10-mm-5-sht-raznocvetnye/	
Набор крючков для вязания, с пластиковыми ручками и колпачками, d = 1,5-2,5 мм, 14 см, 3 шт, цвет МИКС	Создание слаймов	38	https://www.sima-land.ru/9586767/nabor-kryuchkov-dlya-vyazaniya-s-plastikovymi-ruchkami-i-kolpachkami-d-1-5-2-5-mm-14-cm-3-sht-cvet-miks/	
Ткацкий станок, 6 цветов ниток	Создание слаймов	1499	https://www.sima-land.ru/1357576/tkackiy-stanok-6-cvetov-nitok/	Конструктор «Ткацкий станок» познакомит ваших деток с древним видом искусства — ткачеством. На таком станке юные рукодельники создадут гобелены с разными узорами. Набор состоит из 6 основных деталей, которые выполнены из берёзы. Благодаря такому материалу игрушка прослужит долгое время. Иллюстрированная инструкция подскажет, как правильно соединить элементы набора. Может потребоваться помощь родителей. Такое творческое занятие благотворно влияет на работу мелкой моторики пальцев и развивает креативное мышление ребёнка. В комплект входит: Размер рамки станка: 24,5×18 см. Рекомендован для детей с 5 лет.
Тесьма декоративная текстиль "Джут яркий" намотка 10 метров набор 24 шт МИКС 4,5х25х25 см	Создание слаймов	1250	https://www.sima-land.ru/4290411/tesma-dekorativnaya-tekstil-dzhut-yarkiy-namotka-10-metrov-nabor-24-sht-miks-4-5h25h25-cm/	
Набор маркеров для петель «Сердце», 2 см, 20 шт., розовый	Создание слаймов	2950	https://www.sima-land.ru/7112205/nabor-markerov-dlya-petel-serdce-2-cm-20-sht-rozovyy/	Булавки используются для отметки различных участков вязания: петли реглана, места начала прибавления петель или кругового оборота. С помощью маркировочных колец и булавок можно сделать отметки на полотне: выделить нужный ряд или петлю. Длинный хвостик легко вдевается в петлю или столбик, затем фиксируется в замке, не деформирует и не растягивает вязку. Разными цветами удобно помечать участки в одном изделии: выделить спинку, пройму, полочку. Если допущена ошибка, можно за пару секунд снять и переставить булавку на другое место.
Машина для вязания «Вяжу как мама», с аксессуарами	Создание слаймов	1999	https://www.sima-land.ru/4413557/mashina-dlya-vyazaniya-vyazhu-kak-mama-s-aksessuarami-2/	С набором для вязания маленькая рукодельница смастерит тёплые зимние вещи — шапки, шарфы — и сможет порадовать себя, своих кукол или домашних питомцев. Вязальная машина проста в использовании, работать на ней сможет даже новичок. Как вязать Диаметр между крючками: 13 см. Машинка на 22 петли. На детской машинке можно вязать по кругу и создавать разноцветные модели, просто вводя в работу нить другого оттенка. Вещи, изготовленные своими руками, ребёнок будет носить или дарить друзьям и близким с большим удовольствием. Занятия со швейной машинкой обучают ребёнка основам рукоделия, развивают творческие способности, усидчивость, аккуратность. Возможно, детское хобби вашей принцессы превратится в любимое занятие на всю жизнь! Машинка «Вяжу как мама» станет желанным подарком на Новый год для вашей малышки. Она поможет согреть близких тёплыми зимними вещами. Окружайте ребёнка полезными играми!
