name	category	price	rating	url	description
Маркер для ткани, водорастворимый, 14 см, голубой	Принадлежности для кроя	54	4.8	https://www.sima-land.ru/4450955/marker-dlya-tkani-vodorastvorimyy-14-cm-goluboy/	Водорастворимый маркер подходит для разного вида ткани. Пользоваться данным инструментом достаточно просто — стоит расчертить выкройку и подождать проявления. Если цвет тусклый, следует выполнить данные манипуляции несколько раз. Правила хранения: маркер следует хранить вдали от нагревательных элементов и прямого действия солнечных лучей, а также от мороза. Это поможет сохранить их функциональные свойства на долгое время.
Наклейка для цветов и подарков «Яйца на пасху», 16×9.5 см	Флористика	7.4	4.8	https://www.sima-land.ru/9533340/nakleyka-dlya-cvetov-i-podarkov-yayca-na-pashu-16-9-5-cm/	Наклейки для цветов и подарков позволяют красиво и быстро оформить упаковку изделий ручной работы и подарков. Они выручают, когда нужно заклеить прозрачный или бумажный пакетик, закрыть конверт, зафиксировать крышку коробки, или просто декорировать упаковку. Стикер будет не только украшением, но и маленьким приятным сюрпризом на упаковке для ваших покупателей.  Температурных ограничений нет.
Грунт для аквариума "Галька цветная, лимонный-салатовый-белый-изумрудный" 800г фр 8-12 мм	Аквариумистика	171	5	https://www.sima-land.ru/1198706/grunt-dlya-akvariuma-galka-cvetnaya-limonnyy-salatovyy-belyy-izumrudnyy-800g-fr-8-12-mm/	Декоративный грунт изготовлен из природного сырья, не токсичен, безопасен для человека и окружающей среды. Грунт окрашен Цветной грунт применяется: • Для декорирования аквариумов; • Для террариумов, флорариумов; • Декоративная засыпка для комнатных горшечных растений; • Для создания декоративных интерьерных композиций; • В ландшафтном дизайне: для создания сухих ручьев, для декорирования клумб и садовых дорожек, искусственных водоемов, для декоративной отсыпки и создания узоров на ландшафте; • Для декоративной засыпки в стеклянные бутыли и вазы. Какой грунт выбрать? Выбор основы вашего водного мира зависит от того, планируется ли высаживание водорослей: • Песок, кварц или галька диаметром до 1 см – оптимальное решение в резервуарах без растительности. Такую природную смесь необходимо выложить по дну слоем от 1,5 до 5 см. • Травникам или другим водоемам с живыми водорослями понадобятся базовая почва, а также питательная подложка под нее. Песок, гальку размером до 3-4 мм можно смело использовать как основу. Фракция: 8-12 мм. Масса нетто: 800 г.
Пластилин 16 цветов 240 г ZOO	Принадлежности для лепки	203	5	https://www.sima-land.ru/4902498/plastilin-16-cvetov-240-g-zoo/	
Фломастеры 36 цветов, вентилируемый колпачок, в блистере	Принадлежности для рисования	205	4.9	https://www.sima-land.ru/5483638/flomastery-36-cvetov-ventiliruemyy-kolpachok-v-blistere/	Набор фломастеров Calligrata содержит 36 ярких и насыщенных цветов. Вентилируемый колпачок обеспечивает безопасное рисование для ребенка . Идеально подходят для детей от 3-х лет и для тех, кто только начинает свой творческий путь. Фломастеры состоят из пластика, чернил. Упаковка представлена в виде PVC пакета. Благодаря фломастерам Calligrata Вы сможете воплотить все свои творческие фантазии в реальность.
Трансформационная игра «Ключ к подсознанию», 50 карт (7х12 см), 50 жетонов (3х7 см), игровое поле (67х72 см), 16+	Психология и эзотерика	1089	5	https://www.sima-land.ru/9250524/transformacionnaya-igra-klyuch-k-podsoznaniyu-50-kart-7h12-cm-50-zhetonov-3h7-cm-igrovoe-pole-67h72-cm-16-plus/	Трансформационная игра Перед вами набор, который поможет найти дорогу к своему подсознанию с помощью специального игрового поля и метафорических ассоциативных карт. Набор подходит как для индивидуальной работы, так и для проработки проблем с психологом в формате игры. Основной смысл работы с игрой заключается в размышлениях о себе, своих особенностях, желаниях, возможностях и в проработке самооценки. Благодаря подробной инструкции трансформационная игра «Ключ к подсознанию» не требует участия специалиста с опытом ведения индивидуальной психологической работы. Кому будет полезен набор? В наборе вы найдёте:
Краска акриловая матовая в тубе 75мл CALLIGRATA, КМ019, Розовая, пантон 235С	Товары для художников	39.7	5	https://www.sima-land.ru/9953654/kraska-akrilovaya-matovaya-v-tube-75ml-calligrata-km019-rozovaya-panton-235s/	Художественные акриловые краски Calligrata объемом банки 75 мл, предназначены для разных художественных, декоративных и дизайнерских работ. Красками можно работать бумага, картон, грунтованный холст, дерево. Для достижения необходимой консистенции используйте загустители или разбавители для акриловых красок. Рекомендация: при работе с гладкими поверхностями используйте грунт. Характеристики: 
Свистулька керамическая «Совушка»	Музыкальные инструменты	60	5	https://www.sima-land.ru/2294780/svistulka-keramicheskaya-sovushka/	Игрушка-свистулька — это не просто игрушка, это настоящий мини-оркестр, который поместится в маленькой ручке, музыкальный инструмент, который не даст заскучать вашему малышу. С помощью керамической птички кроха сможет сочинять мелодии и тренировать музыкальный слух. Данная игрушка имеет секрет: если её наполнить небольшим количеством воды, то птица будет издавать волшебную соловьиную трель. Тональность звука можно настроить, просто меняя уровень воды. Игрушка-свистулька также развивает и тренирует мелкую моторику, координацию движений и дыхательную систему, разжигает творческое воображение.
Алмазная мозаика на фигурке «Создай брелок. Алмазный мишка», розовый	Алмазная мозаика	529	4.9	https://www.sima-land.ru/9280932/almaznaya-mozaika-na-figurke-sozday-brelok-almaznyy-mishka-rozovyy/	С набором для творчества «Алмазный мишка» у ребёнка получится создать сияющий брелок своими руками. Как сделать брелок Что в наборе:
Наклейки многоразовые «Учимся сравнивать», формат А4	Детские книги	79	4.8	https://www.sima-land.ru/3950969/nakleyki-mnogorazovye-uchimsya-sravnivat-format-a4/	Серия «Мои обучающие наклейки» представлена 8 книгами различной тематики: С многоразовыми наклейками ребёнок сможет изучить буквы алфавита, цифры, цвета, геометрические фигуры и даже запомнит первые английские слова! Соберите всю серию наклеек и расширяйте кругозор малыша! Рекомендовано для детей от 2 лет.
Водная раскраска «Рисуем водой», 12 стр., 20 × 25 см, Дисней	Детские книги	64	4.9	https://www.sima-land.ru/9177316/vodnaya-raskraska-risuem-vodoy-12-str-20-25-cm-disney/	Волшебная книга для рисования водой удивит малыша и его родителей. Книга выполнена из плотной бумаги. Внутри есть 8 рисунков для раскрашивания. Во время рисования малыш будет заполнять различные элементы рисунка, потренирует моторику и внимание. Как работать с книгой Особенности книги
Книжка с наклейками «Буквы и слова», 12 стр., более 50 наклеек	Детские книги	75	5	https://www.sima-land.ru/3362252/knizhka-s-nakleykami-bukvy-i-slova-12-str-bolee-50-nakleek/	Развивающая книга с наклейками создана специально для маленьких непосед, которые хотят всё знать. Внутри ребёнок найдёт много увлекательных заданий, красочных иллюстраций и наклеек. Удобный формат Очевидная польза Книга с наклейками направлена на закрепление группы важных навыков: письма, речи, логического мышления и внимательности. Занимайтесь с малышом регулярно, и прогресс не заставит себя ждать. Пособие предназначено для детей старше 3 лет. В серии «Наклейки-занималки» представлено 6 изданий на разные темы:
Наклейки детские бумажные «Космос», 11×15.5 см	Принадлежности для творчества	7.5	5	https://www.sima-land.ru/9246803/nakleyki-detskie-bumazhnye-kosmos-11-15-5-cm/	
Карандаши двусторонние, заточенные, 12 штук, 24 цвета, корпус треугольный, деревянный, в картонной коробке	Принадлежности для рисования	79	4.5	https://www.sima-land.ru/3883843/karandashi-dvustoronnie-zatochennye-12-shtuk-24-cveta-korpus-treugolnyy-derevyannyy-v-kartonnoy-korobke/	Двусторонние цветные карандаши предназначены для детского творчества. Отличный вариант для школьного пенала. Способствуют развитию творческого мышления, мелкой моторики рук, цветового восприятия, фантазии и воображения ребенка. Наполните жизнь вдохновением - закажите уже сегодня в нашем интернет-магазине!
Лента атласная, 50 мм, 23±1 м, жёлтая №15	Ленты	189	5	https://www.sima-land.ru/1218405/lenta-atlasnaya-50-mm-23-1-m-zheltaya-15/	Декоративная атласная лента – это идеальный спутник для вашего творчества и праздников. Праздничный тренд, который всегда будет к месту. Упаковочная ленточка прекрасно подойдет для рукоделия, украшения подарков и создания удивительных композиций из воздушных шаров. Вы можете украсить букеты цветов, привязав к ним яркую ленточку. Это добавит особого очарования вашему подарку. Игрушки также можно сделать более интересными, если использовать красивую упаковочную ленту в оформлении. Она идеально подойдет для новогодних сюрпризов и рождественских даров. На дни рождения и другие важные события не обойтись без новогодней подарочной ленты. Упаковка коробок со сладкими подарками станет настоящим искусством с этой великолепной деталью. Она отлично сможет дополнить ваши идеи на 14 февраля, 23 февраля, 8 марта или в день матери. Кроме того, такая лента может стать оригинальным украшением на голове именинницы! Сделайте супер банты первоклассника или создайте необычный аксессуар для вечеринки. Ленты идеально подходят для шитья одежды, ведь они могут добавить немного волшебства каждому изделию. Наши ленточки не содержат люрекса, что делает их особенно приятными на ощупь и легко сочетаемыми с любыми материалами. Упаковочная лента займет достойное место в наборе швейной фурнитуры для творчества как тесьма. Благодаря своей универсальности она найдет применение в самых разных проектах. Если вы хотите украсить мероприятие или помочь с декором? Эта продукция станет незаменимой при создании флористических композиций. Завязывайте косички на девичник узкими атласными полосками, чтобы добавить романтики и стиля вашим праздникам. Не бойтесь проявлять фантазию! Делая ободки и бантики из этой чудесной ленточки, вы сможете создать уникальные украшения для волос и вечеринок. Создавайте шикарные розы своими руками – этот процесс принесет радость вам и всем вокруг! И не забудьте о праздничных елках! Используйте яркую упаковочную ленту, чтобы делать роскошные бантики прямо на ели. Это увидят все гости во время новогоднего веселья! Погрузитесь в мир творчества с атласной лентой! Ваши идеи будут воплощены легко и приятно, а результаты порадуют окружающих. Пусть каждое ваше творение станет произведением искусства! Атласная лента гладкая и приятная на ощупь. Используйте её для отделки изделий, украшения подарков, свадебного оформления, а также в техниках скрапбукинг и канзаши. При производстве лент используется только современное оборудование и качественные материалы.
Булавки английские, 32 мм, 1000 шт, цвет серебряный	Принадлежности для шитья	399	4.9	https://www.sima-land.ru/3607746/bulavki-angliyskie-32-mm-1000-sht-cvet-serebryanyy/	Английская булавка — универсальный помощник в быту, при шитье и рукоделии. Она пригодится для закалывания материала, драпировки ткани, создания украшений. С ней вы можете прикрепить к одежде или домашнему текстилю мягкие аксессуары. Острый край булавки прячется в безопасную петельку, она не уколет и прослужит вам долго.
Наклейка для цветов и подарков «Пасхальные узоры», 16×9.5 см	Флористика	8.1	5	https://www.sima-land.ru/10326844/nakleyka-dlya-cvetov-i-podarkov-pashalnye-uzory-16-9-5-cm-2/	Наклейки для цветов и подарков позволяют красиво и быстро оформить упаковку изделий ручной работы и подарков. Они выручают, когда нужно заклеить прозрачный или бумажный пакетик, закрыть конверт, зафиксировать крышку коробки, или просто декорировать упаковку. Стикер будет не только украшением, но и маленьким приятным сюрпризом на упаковке для ваших покупателей. Температурных ограничений нет.
Раскраска для девочек «Прекрасные принцессы», 12 стр., 2+	Детские книги	30.5	5	https://www.sima-land.ru/2012642/raskraska-dlya-devochek-prekrasnye-princessy-12-str-2-plus/	Раскраска «Прекрасные принцессы» — это не просто набор картинок, а захватывающее приключение в мир творчества для вашей маленькой леди! Вместе с принцессами малышка окунётся в сказочный мир принцесс, прочитает истории, развивая при этом множество полезных навыков. Преимущества
Набор ватманов чертёжных А1, 5 листов, 200 г/м², ГОЗНАК	Бумага и бумажная продукция	135	5	https://www.sima-land.ru/4466900/nabor-vatmanov-chertezhnyh-a1-5-listov-200-g-m-goznak/	
Лента атласная, с золотым люрексом, 6 мм, 23±1 м, белая №001	Ленты	35	4.9	https://www.sima-land.ru/1902783/lenta-atlasnaya-s-zolotym-lyureksom-6-mm-23-1-m-belaya-001/	Атласная лента широко применяется в декорировании интерьера и украшении одежды, создании аксессуаров и игрушек, скрапбукинге и вышивании. Она изготовлена из полиэстера, обладает высокой прочностью и устойчива к тепловому воздействию. Изделие гладкое и приятное на ощупь, не пушится и отливает лёгким блеском. 
Бумага упаковочная тишью, чёрный, 50×66 см	Подарочная упаковка	9.4	4.9	https://www.sima-land.ru/2654624/bumaga-upakovochnaya-tishyu-chernyy-50-66-cm/	Оригинальный дизайн подарочной бумаги выделит ваш подарок из массы других. Подарочная упаковка - это современный и удобный способ оформления букетов, композиций. Подарочная бумага придает композиции оригинальность и индивидуальность. Упаковочная пленка для подарков защищает изделие от внешних воздействий. Бумагу можно использовать для оформления  букетов, подарков, сувениров, для упаковки конфет и сладостей на Новый год, День Рождения и другие праздники.
Набор атласных лент «Радуга», 5 шт., 10 мм, 23±1 м	Ленты	150	5	https://www.sima-land.ru/3758783/nabor-atlasnyh-lent-raduga-5-sht-10-mm-23-1-m/	Атласная лента гладкая и приятная на ощупь. Используйте её для отделки изделий, украшения подарков, в свадебном оформлении, а также в скрапбукинге и канзаши.  Желательна ручная стирка с использованием щадящих моющих средств при температуре не выше 40 °C.  Не рекомендуется гладить при температуре выше 110 °C.  В набор входят ленты с номерами цветов №16,19,26,34,40. 
Электроприбор для выжигания по дереву «Узор-10к»	Поделки из дерева	1899	5	https://www.sima-land.ru/3742552/elektropribor-dlya-vyzhiganiya-po-derevu-uzor-10k/	Освойте один из самых интересных и кропотливых видов декоративного искусства – выжигание по дереву и ткани с электроприбором «Узор 10К» от «Десятого королевства»! Техническая информация о приборе: Особенность набора «Узор 10К» в том, что с его помощью можно освоить сразу 2 хобби – пирографию (выжигание по дереву) и гильоширование (выжигание по ткани).
Заплатки для одежды, 15,5 × 9,5 см, термоклеевые, пара, цвет чёрный	Декоративные элементы для одежды	55	4.9	https://www.sima-land.ru/3035090/zaplatki-dlya-odezhdy-15-5-9-5-cm-termokleevye-para-cvet-chernyy/	Инструкция по работе с заплатками Вот и всё. Наслаждайтесь результатом! Рекомендации
Пипетка 3 мл для опытов и творчества, набор 10 шт.	Рисование	49	4.9	https://www.sima-land.ru/5135340/pipetka-3-ml-dlya-opytov-i-tvorchestva-nabor-10-sht/	Пластиковые пипетки являются одноразовыми и оснащены тонким носиком и резервуаром-грушей. Где пригодятся пластиковые пипетки:
