name	category	price	rating	url	description
Наклейки интерьерные "Сердца", декор настенный зеркальный, набор 10 шт 9 - 15см	Зеркала	105	4.9	https://www.sima-land.ru/5451344/nakleyki-interernye-serdca-dekor-nastennyy-zerkalnyy-nabor-10-sht-9-15sm/	Добавьте нотку романтики и тепла в ваш интерьер с этим стильным набором зеркальных наклеек в форме сердечек! Комплект включает десять элементов различных размеров (от 9 до 15 см), изготовленных из высококачественного акрила. Каждая наклейка имеет зеркальную поверхность, которая отражает свет и придает декору дополнительную объемность и глубину. Изящные сердечки станут великолепным украшением для стен гостиной, спальни, детской комнаты или любого другого пространства, куда вы хотите внести нотку любви и нежности. Разместите их произвольно, создавая иллюзию парящего сердца, или следуйте собственному творческому замыслу, формируя уникальные композиции. Установка наклеек проста и не требует специальных инструментов – достаточно выбрать подходящее место и аккуратно приложить каждое сердечко к поверхности. Легко крепятся на любые гладкие стены, двери или мебель, добавляя интерьеру динамичности и романтичной атмосферы. С таким декором ваш дом наполнится атмосферой любви, уюта и теплоты. Пусть эти зеркальные сердечки принесут радость и вдохновение в вашу повседневную жизнь! Нанесение на поверхность:
Кашпо деревянное 24.5×13.5×9 см "Двушка Лайт", двухреечное, натуральный Дарим Красиво	Упаковка для цветов	180	4.9	https://www.sima-land.ru/4473953/kashpo-derevyannoe-24-5-13-5-9-cm-dvushka-layt-dvuhreechnoe-naturalnyy-darim-krasivo-5/	
Алмазная мозаика с полным заполнением на холсте «Розы на кусте», 15 х 21 см	Алмазная мозаика	190	4.7	https://www.sima-land.ru/5498155/almaznaya-mozaika-s-polnym-zapolneniem-na-holste-rozy-na-kuste-15-h-21-cm/	Разложите кристаллики с помощью карандаша по указанной схеме, заполнив полотно. На картине уже обозначены необходимые оттенки. Холст с клеевым покрытием будет надёжно удерживать стразы. Алмазная вышивка с полным заполнением - это отличный способ провести вечер в творческой атмосфере. Готовое изделие украсит интерьер или станет оригинальным подарком.
Лента атласная, 50 мм × 23 ± 1 м, цвет небесно-голубой №278	Ленты	182	5	https://www.sima-land.ru/1218430/lenta-atlasnaya-50-mm-23-1-m-cvet-nebesno-goluboy-278/	Декоративная атласная лента – это идеальный спутник для вашего творчества и праздников. Праздничный тренд, который всегда будет к месту. Упаковочная ленточка прекрасно подойдет для рукоделия, украшения подарков и создания удивительных композиций из воздушных шаров. Вы можете украсить букеты цветов, привязав к ним яркую ленточку. Это добавит особого очарования вашему подарку. Игрушки также можно сделать более интересными, если использовать красивую упаковочную ленту в оформлении. Она идеально подойдет для новогодних сюрпризов и рождественских даров. На дни рождения и другие важные события не обойтись без новогодней подарочной ленты. Упаковка коробок со сладкими подарками станет настоящим искусством с этой великолепной деталью. Она отлично сможет дополнить ваши идеи на 14 февраля, 23 февраля, 8 марта или в день матери. Кроме того, такая лента может стать оригинальным украшением на голове именинницы! Сделайте супер банты первоклассника или создайте необычный аксессуар для вечеринки. Ленты идеально подходят для шитья одежды, ведь они могут добавить немного волшебства каждому изделию. Наши ленточки не содержат люрекса, что делает их особенно приятными на ощупь и легко сочетаемыми с любыми материалами. Упаковочная лента займет достойное место в наборе швейной фурнитуры для творчества как тесьма. Благодаря своей универсальности она найдет применение в самых разных проектах. Если вы хотите украсить мероприятие или помочь с декором? Эта продукция станет незаменимой при создании флористических композиций. Завязывайте косички на девичник узкими атласными полосками, чтобы добавить романтики и стиля вашим праздникам. Не бойтесь проявлять фантазию! Делая ободки и бантики из этой чудесной ленточки, вы сможете создать уникальные украшения для волос и вечеринок. Создавайте шикарные розы своими руками – этот процесс принесет радость вам и всем вокруг! И не забудьте о праздничных елках! Используйте яркую упаковочную ленту, чтобы делать роскошные бантики прямо на ели. Это увидят все гости во время новогоднего веселья! Погрузитесь в мир творчества с атласной лентой! Ваши идеи будут воплощены легко и приятно, а результаты порадуют окружающих. Пусть каждое ваше творение станет произведением искусства! Атласная лента гладкая и приятная на ощупь. Используйте её для отделки изделий, украшения подарков, свадебного оформления, а также в техниках скрапбукинг и канзаши. При производстве лент используется только современное оборудование и качественные материалы.
Фетр жесткий 1 мм "Белоснежный" набор 10 листов формат А4	Принадлежности для творчества	210	4.6	https://www.sima-land.ru/2277702/fetr-zhestkiy-1-mm-belosnezhnyy-nabor-10-listov-format-a4/	
Переводные татуировки детские «Бабочки», тату — 2 листа, золото	Принадлежности для творчества	62	5	https://www.sima-land.ru/5160975/perevodnye-tatuirovki-detskie-babochki-tatu-2-lista-zoloto/	С набором детских переводок каждая девочка сможет украсить не только себя, но и обложку тетради или мебель. Переводные картинки быстро наносятся на кожу и легко смываются. В комплекте 2 листа тату с милыми рисунками.
Наклейки многоразовые «Настоящие динозавры»	Детские книги	115	4.9	https://www.sima-land.ru/3789688/nakleyki-mnogorazovye-nastoyaschie-dinozavry/	Книжка-раскладушка раскрывается как плакат, в ней нет переплёта, поэтому ребёнку с ней будет удобно заниматься. В этой необычной книжке вы найдёте яркие иллюстрации. Они не только понравятся малышу, но и помогут ему развить образное и пространственное мышление. В наборе есть 30 многоразовых наклеек (можно наклеить по 3–4 раза). Рекомендовано для детей от 2 лет.
Мольберт детский двусторонний «Растущий», регулируется по высоте, размер 75.5×51.6×7 см	Рисование	2849	4.8	https://www.sima-land.ru/4038707/molbert-detskiy-dvustoronniy-rastuschiy-reguliruetsya-po-vysote-razmer-75-5-51-6-7-cm/	Двухсторонний мольберт подходит для детей от 1,5 лет. Особенности: В комплект входит:
Наклейки многоразовые «Такие разные профессии», формат А4	Детские книги	106	4.7	https://www.sima-land.ru/3950982/nakleyki-mnogorazovye-takie-raznye-professii-format-a4/	Серия «Познавательные наклейки» представлена 10 книгами различной тематики: С помощью ярких многоразовых наклеек ребёнок сможет изучить, какие бывают профессии, кто живёт в лесу и на ферме и что происходит с природой в разное время года. Соберите всю серию наклеек и расширяйте кругозор малыша! Рекомендовано для детей от 2 лет.
Резинка вязаная, 10 мм, 10±0.5 м, чёрная	Отделочные материалы	95	4.9	https://www.sima-land.ru/6906837/rezinka-vyazanaya-10-mm-10-0-5-m-chernaya/	Вязаная резинка является универсальной, используется при производстве одежды для детей и взрослых. Вы можете пришить её на нижнюю часть брюк, на штаны, детские колготки, в пояс на платье и многое другое. Резинка особенно актуальна для тех, кто ведёт активный образ жизни: с ней вы сможете подогнать размеры спортивного костюма под себя и выполнять любимые упражнения с комфортом.
Набор текстильных деталей для декора «Бомбошки», 50 шт., размер 1 шт. — 2 см	Принадлежности для творчества	89	5	https://www.sima-land.ru/10583439/nabor-tekstilnyh-detaley-dlya-dekora-bomboshki-50-sht-razmer-1-sht-2-cm/	Набор из мягких помпонов станет отличным выбором для любых творческих и декоративных проектов. Эти милые и пушистые детали добавят яркости и объёма вашим креативным работам. Легкие и приятные на ощупь, бомбошки легко крепятся к любой поверхности с помощью клея или ниток. Набор бомбошек подходит для создания оригинальных украшений, игрушек, открыток, альбомов и других поделок. Легкость в использовании и универсальность этих декоративных элементов делает их незаменимыми для любого рукодельного проекта. Особенности
Синельная проволока с ворсом для поделок и декора набор 50 шт., размер 1 шт. — 30×0.6 см, цвет чёрный	Принадлежности для творчества	99	5	https://www.sima-land.ru/7875794/sinelnaya-provoloka-s-vorsom-dlya-podelok-i-dekora-nabor-50-sht-razmer-1-sht-30-0-6-cm-cvet-chernyy/	Набор для творчества из текстильной проволоки с ворсом идеально подходит для изготовления поделок, украшений и декора. Благодаря насыщенному цвету, он помогает воплощать яркие и стильные идеи. Гибкая основа и мягкий ворс делают работу с материалом простой и комфортной, подходящей даже для детей. Что входит в набор? Преимущества использования Идеи для применения С помощью этого набора можно создавать интересные поделки для детских праздников, декорировать открытки или подарочные упаковки. Бирюзовый цвет придаст готовым изделиям стильный и свежий вид, а мягкая текстура проволоки поможет создавать как сложные, так и простые формы. Можно использовать для украшения ёлки, аппликации, создания топиария, в качестве каркаса для создания игрушки и др.. Этот набор станет отличным выбором для творческих занятий, развития мелкой моторики у детей и создания уникальных украшений своими руками. Добавьте немного вдохновения и сделайте своими руками что-то действительно особенное!
Гравюра детская «Человек-паук», набор 2 шт, 10 х 15 см	Гравюры	29	5	https://www.sima-land.ru/9667461/gravyura-detskaya-chelovek-pauk-nabor-2-sht-10-h-15-cm/	Чтобы создать красивую гравюру, достаточно процарапать намеченные контуры рисунка специальным инструментом — штихелем. Дети будут с удовольствием соскребать верхний слой картины по контурам рисунка, под которым находится цветное изображение! Готовая гравюра станет ещё и приятным поздравлением для родных и близких малыша. При работе с набором у ребёнка развивается мелкая моторика и координация движений, формируются такие важные качества, как усидчивость, аккуратность и внимательность. Малыш натренирует руку к письму перед школой, ведь умение проводить точные линии непременно пригодится ему на уроках. Что входит в набор? Наслаждайтесь волшебными моментам творчества!
Мат для резки, трёхслойный, 30×21 см, А4, зелёный	Принадлежности для кроя	170	5	https://www.sima-land.ru/7876586/mat-dlya-rezki-trehsloynyy-30-21-cm-a4-zelenyy/	Трёхслойный мат для резки представляет собой универсальный инструмент, который широко используется для скрапбукинга, пэчворка, квилтинга, вышивки и других видов творчества. Основные преимущества мата Мат для резки: кому пригодится и как использовать — смотрите в видеообзоре. Рекомендации по использованию и уходу
Фломастеры 24 цветов, TOP Calligrata, в блистере	Принадлежности для рисования	226	5	https://www.sima-land.ru/9866301/flomastery-24-cvetov-top-calligrata-v-blistere/	
Набор трафарет-раскраска Calligrata, 6 штук (транспорт, инструменты, космос, морские обитатели, животные Африки, листья), для мальчиков	Принадлежности для рисования	195	4.9	https://www.sima-land.ru/1853803/nabor-trafaret-raskraska-calligrata-6-shtuk-transport-instrumenty-kosmos-morskie-obitateli-zhivotnye-afriki-listya-dlya-malchikov/	Трафарет-раскраска изготовлен из высококачественной прочной пластмассы, безопасен в использовании. В упаковку входят красочные иллюстрации, которые показывают, как выглядят рисунки в раскрашенном виде. Характеристики: Поставляются в нескольких вариантах цвета (без возможности выбора).
Книга детская «Рисуем пластилином», 24 стр., А4, Синий трактор	Детские книги	259	5	https://www.sima-land.ru/9521375/kniga-detskaya-risuem-plastilinom-24-str-a4-siniy-traktor/	Книга «Рисуем пластилином» с Синим трактором — это увлекательное руководство для детей, которые любят создавать яркие поделки. Подходит для мальчиков и девочек от четырёх лет, помогая развивать творческие способности и мелкую моторику. Особенности Творчество с пользой «Рисуем пластилином» помогает ребёнку освоить основы работы с материалом через простые и увлекательные задания. Каждая страница предлагает новую идею, где нужно выкладывать пластилин, создавая яркие картинки. Такие занятия развивают аккуратность, внимание к деталям и воображение. Работа с книгой становится не просто развлечением, а важным этапом подготовки к творческому развитию. «Творить легко» теперь доступно каждому!
Кружево капроновое, 35 мм × 10 ± 1 м, цвет белый	Отделочные материалы	89	4.9	https://www.sima-land.ru/2795927/kruzhevo-kapronovoe-35-mm-10-1-m-cvet-belyy/	Кружевные капроновые ленты отличаются большей воздушностью. Их лёгкая ткань выглядит ещё изящнее и позволяет коже дышать. Капроновое кружево – это тесьма с ажурной вышивкой, которая чаще всего используется швеями и рукодельницами для оформления одежды и предметов интерьера.  Подобные ленты используют для топов, блуз, сорочек и лёгких платьев. С помощью капронового кружева вы сможете украсить нижнее бельё или корсет. Также оно пригодится при оформлении подарков и предметов интерьера. 
Набор ниток «Пастель», 40/2, 200 м, 5 шт., разноцветный	Принадлежности для шитья	69	5	https://www.sima-land.ru/7314079/nabor-nitok-pastel-40-2-200-m-5-sht-raznocvetnyy/	Часто возникает необходимость отремонтировать или подшить одежду. В такой ситуации вас выручит данный набор. Разнообразие цветов позволит подобрать нить для каждого предмета гардероба. А ещё он пригодится, если вы увлекаетесь рукоделием. Нитки 40/2 используются для всех основных видов швов. Они сделаны из полиэстера, который отличается прочностью и надёжно скрепит части изделия. Благодаря своим универсальным свойствам нити находят широкое применение. Они используются при производстве тонких и средних тканей, костюмной, джинсовой одежды, а также в мебельной, обувной и автомобильной промышленности. Применяются при пошиве трикотажа, постельных принадлежностей, верхней, спортивной одежды, домашнего текстиля и прочего. 
Наклейки набор «Тело человека», 2 шт. по 16 стр.	Детские книги	216	5	https://www.sima-land.ru/4859821/nakleyki-nabor-telo-cheloveka-2-sht-po-16-str/	Набор книг с наклейками «Тело человека» — это увлекательное путешествие в мир анатомии для детей от 3 лет. В комплекте две книги: «Как устроено моё тело» и «Секреты тела человека». С помощью ярких аппликаций и интересных заданий ребёнок узнает, как работают органы и системы, и поймёт, почему тело человека — это удивительный механизм. Особенности Почему это полезно? Набор помогает детям в игровой форме изучить строение тела человека. Ребёнок узнает, как работают органы, и поймёт, почему тело — это сложная и удивительная система. Задания с наклейками развивают мелкую моторику, внимание и любознательность, а также расширяют кругозор. Этот набор станет отличным подарком для любознательных малышей, которые только начинают познавать мир. Универсальная тематика делает его подходящим для любого праздника или просто в качестве полезного развлечения.
Маркер меловой MunHwa CM-05, 3.0 мм, белый	Товары для художников	336	4.3	https://www.sima-land.ru/1502599/marker-melovoy-munhwa-cm-05-3-0-mm-belyy/	Маркер меловой MunHwa "Chalk Marker" - жидкий мел на спиртовой основе. Используется для декорирования зеркал и стекол, оформления окон, для надписей на металле и пластике. Особенности Меловой маркер MunHwa "Chalk Marker" - это твой помощник для воплощения всех креативных решений в жизнь. Инструкция по применению: Характеристики
