name	category	price	rating	url	description
Коробка - пакет, с ручками, крафт, 15×11×9 см	Подарочная упаковка	44	4.4	https://www.sima-land.ru/9898519/korobka-paket-s-ruchkami-kraft-15-11-9-cm/	Подарочная коробка-пакет-  это удивительный способ представить ваш подарок и сделать его упаковку особенно привлекательной. Коробка-пакет имеет современный и стильный дизайн. Благодаря окну в упаковке, получатель сразу увидит часть содержимого, что создает интерес и ожидание. Наличие прочных ручек делает коробку-пакет легкой в переноске и придает упаковке дополнительное удобство. Коробка-пакет обычно изготавливается из качественного картона, что обеспечивает надежность и долговечность упаковки. Этот тип коробки идеально подходит для различных видов подарков, будь то одежда, книги, косметика, сладости или другие предметы. Она также может использоваться для оформления подарков на разные праздники и события. Коробку-пакет легко украсить с помощью лент, бантов, наклеек и других декоративных элементов, чтобы придать ей персональное оформление, соответствующее вашим предпочтениям и событию. Коробка-пакет  - это не только способ упаковать ваш подарок, но и создать удивительный момент ожидания для того, кто его получит. Ее функциональность и стильный дизайн делают ее отличным выбором для разных праздничных и специальных случаев.
Аквамозаика «Супермастер», 768 шариков	Развивающие и обучающие игрушки	422	5	https://www.sima-land.ru/9900638/akvamozaika-supermaster-768-sharikov/	С аквамозаикой от торговой марки «Эврики» ребёнок соберёт объёмные фигурки из шариков-пикселей. Детали плотно скрепляются друг с другом. С поделками можно играть или носить с собой как брелоки. Как сделать фигурку Польза занятий с аквамозаикой Игра с мозаикой развивает мелкую моторику, цветовое восприятие и усидчивость, позволяет ребёнку проявить креативность в удивительном процессе изготовления фигурки. Подходит для детей от 4 лет.
Цепочка для сумки, с карабинами, металлическая, плоская, плотное плетение, 15 × 10 мм, 60 см, цвет серебряный	Фурнитура для сумок	108.75	5	https://www.sima-land.ru/9921235/cepochka-dlya-sumki-s-karabinami-metallicheskaya-ploskaya-plotnoe-pletenie-15-10-mm-60-cm-cvet-serebryanyy/	Цепочка для сумки – это важная деталь, которая часто подвергается значительным нагрузкам, механическим воздействиям и находится в постоянном контакте с ладонью.  В мире моды не было такого периода, когда бы сумка на цепочке не попадала на подиумы  недели моды. Это дизайн, не подвластный времени, и с каждым годом он модернизируется и эффектно обновляется. 
Наклейки «Стикербук. Человек - паук», 150 стикеров, А5, 8 стр., Marvel	Детские книги	231	5	https://www.sima-land.ru/9925225/nakleyki-stikerbuk-chelovek-pauk-150-stikerov-a5-8-str-marvel/	Стикербук «Человек-паук» с 150 наклейками от Marvel — это идеальный выбор для детей, которые любят творчество и супергероев. Компактный формат А5 и мягкая обложка делают альбом удобным для использования в любом месте. Внутри собраны яркие стикеры и задания, которые помогут ребёнку развить воображение и мелкую моторику. Что внутри Альбом предлагает не просто наклейки, а возможность создавать собственные истории. Ребёнок может комбинировать стикеры, украшать ими тетради, блокноты или открытки, а также выполнять задания на страницах. Каждая наклейка становится частью увлекательного процесса, где фантазия знает нет пределов. «Человек-паук» — это больше, чем набор наклеек. Это инструмент для творческого самовыражения, который поможет провести время с пользой. Любимые герои Marvel добавляют особое вдохновение, превращая обычные занятия в настоящее приключение. Подарите ребёнку альбом с наклейками «Человек-паук», чтобы он мог создавать свои собственные шедевры вместе с любимыми персонажами. Этот стикербук станет отличным развлечением для дома, школы или путешествий.
Набор для рисования светом «Магия света: Уэнсдей», А5, ручка с фонариком и невидимыми чернилами	Рисование	50	5	https://www.sima-land.ru/9941222/nabor-dlya-risovaniya-svetom-magiya-sveta-uensdey-a5-ruchka-s-fonarikom-i-nevidimymi-chernilami/	Набор для рисования светом — это отличная возможность развить творческие способности и фантазию ребёнка! С помощью специальной ручки малыш научится рисовать светом, будет создавать картинки, используя трафареты, или придумает собственные сюжеты. Как получить светящийся в темноте рисунок У волшебной ручки есть ещё одна функция — невидимые чернила. Снимите колпачок и напишите что-нибудь на листе бумаги, а затем посветите на надпись фонариком. Рисунок проявится. Обратите внимание! Не пишите стержнем ручки с невидимыми чернилами на поле для рисования светом. Набор рекомендован детям от 3 лет.
Штекер "Божья коровка Дарли" 2,5см, длина 25см, набор 10шт	Обустройство сада	140	5	https://www.sima-land.ru/9948610/shteker-bozhya-korovka-darli-2-5sm-dlina-25sm-nabor-10sht/	
Муляж с магнитом  "Пирожное Джоли" матча, 7х7х6см	Флористика	169	5	https://www.sima-land.ru/9949036/mulyazh-s-magnitom-pirozhnoe-dzholi-matcha-7h7h6sm/	
Муляж "Пончик с сахаром" 7х7х3см	Флористика	163	5	https://www.sima-land.ru/9949087/mulyazh-ponchik-s-saharom-7h7h3sm/	
Наклейки для бизнеса и подарков «Светлый праздник Рамадан», 40 шт, 4 х 4 см	Принадлежности для творчества	58	5	https://www.sima-land.ru/10070648/nakleyki-dlya-biznesa-i-podarkov-svetlyy-prazdnik-ramadan-40-sht-4-h-4-cm-2/	
Стакан непроливайка одинарный 210мл Calligrata "Звездная команда", с рисунком	Принадлежности для рисования	13.5	0	https://www.sima-land.ru/10085255/stakan-neprolivayka-odinarnyy-210ml-calligrata-zvezdnaya-komanda-s-risunkom/	Стакан-непроливайка Calligrata из прочного пластика с оригинальным дизайном сделает процесс рисования более увлекательным Специальная форма крышки стакана исключает возможность вытекания воды. Линия на прозрачном корпусе указывает на максимально возможный уровень наполнения. Выполнен из прочного пластика. Имеются специальные углубления на крышке для размещения кисточек. Полный объем - 210 мл. Объем до уровня - 75 мл. Оригинальный дизайн сделает процесс рисования еще более увлекательным Характеристики: Все без исключения дети и взрослые любят рисовать! Покупайте стакан-непроливайку Calligrata в нашем интернет-магазине!
Альбом «Модная мастерская», с трафаретами и наклейками	Детские книги	345	0	https://www.sima-land.ru/10085418/albom-modnaya-masterskaya-s-trafaretami-i-nakleykami/	Альбом «Модная мастерская» позволит вам самостоятельно разработать собственные эскизы стильных образов. Вы сможете создать 30 оригинальных аутфитов на заготовках с моделями, экспериментировать с цветами, текстурами и фасонами. Как это сделать? В комплекте: Дополнительно Проявляйте фантазию, экспериментируйте и создавайте модные эскизы нарядов!
Декор для творчества «Бабочка», двухслойный, набор 12 шт., размер 1 шт. — 5 × 4 см, цвет голубой	Принадлежности для творчества	179	5	https://www.sima-land.ru/10085733/dekor-dlya-tvorchestva-babochka-dvuhsloynyy-nabor-12-sht-razmer-1-sht-5-4-cm-cvet-goluboy/	
Картина помпонами «Корги», 20 х 20 см	Аппликации	279	5	https://www.sima-land.ru/10106995/kartina-pomponami-korgi-20-h-20-cm/	Аппликация помпонами — это яркий мягки шедевр за считаные минуты. Покажите малышу, как клеить помпоны, и украсьте вместе с ним изображение. Занятия с аппликацией благотворно влияют на развитие мелкой моторики и координации движений, тренируют цветовосприятие и эстетический вкус. Полученная картинка украсит детскую комнату или станет презентом для близких.
Набор бисероплетения в чемоданчике «Рукодельница»	Изготовление украшений	349	0	https://www.sima-land.ru/10122442/nabor-biseropleteniya-v-chemodanchike-rukodelnica-3/	
Сумка для цветов белая влагостойкая, 17×17 - 11.5×11.5 - 20 см	Упаковка для цветов	79	0	https://www.sima-land.ru/10150458/sumka-dlya-cvetov-belaya-vlagostoykaya-17-17-11-5-11-5-20-cm-2/	Букет в такой переноске защищён от внешней среды, так как он достаточно прочный. Благодаря такой таре композиция из роз или других цветов сохранится свежей в несколько раз дольше. Даже небольшой букет в переноске будет смотреться элегантно и дорого. Преимущества:
Бусины пластиковые «Цветы», 1,2×1,2×0,3 см, (набор 30 шт.), цвет радужный	Фурнитура для бижутерии	115	5	https://www.sima-land.ru/10240209/businy-plastikovye-cvety-1-2-1-2-0-3-cm-nabor-30-sht-cvet-raduzhnyy/	Бусины пластиковые «Цветы» — это яркий и оригинальный аксессуар для создания неповторимых украшений. В наборе 30 бусин размером 1,2 х 1,2 х 0,3 см, каждая из которых выполнена в форме цветка. Радужный цвет этих бусин придаст вашим изделиям непередаваемую яркость и игривость, идеально подходя для создания весёлых и красочных аксессуаров. Пластиковые бусины «Цветы» прекрасно подходят для создания браслетов, ожерелий, серёжек, а также для декорирования предметов интерьера или одежды. Радужный оттенок бусин позволяет сочетать их с другими материалами и цветами, добавляя вашим изделиям яркие акценты и динамичность. Этот набор бусин будет отличным выбором для мастеров рукоделия, ищущих яркие и необычные элементы для своих работ. Бусины «Цветы» помогут вам создавать оригинальные и незабываемые изделия, которые привлекут внимание и подчеркнут вашу креативность!
Альбом для рисования А4, 40 листов, на пружине «Тачки»	Бумага и бумажная продукция	82	5	https://www.sima-land.ru/10248918/albom-dlya-risovaniya-a4-40-listov-na-pruzhine-tachki/	
Рисование пастелью c холстом на подрамнике «Закат», набор для творчества	Рисование	179	0	https://www.sima-land.ru/10291579/risovanie-pastelyu-c-holstom-na-podramnike-zakat-nabor-dlya-tvorchestva/	Рисование пастелью – это уникальная техника изобразительного искусства, сочетающая в себе использование линий и штриховки, а также живопись. В набор входит: Познакомьтесь с техникой рисования масляной пастелью!
Искусственное растение шар самшитовый (самшит), размер 21×21 см	Принадлежности для творчества	350	0	https://www.sima-land.ru/10450022/iskusstvennoe-rastenie-shar-samshitovyy-samshit-razmer-21-21-cm/	
Наклейка бумага "Фрукты и ягоды" d=2,5 см 252 шт в рулоне	Принадлежности для творчества	106	5	https://www.sima-land.ru/10450808/nakleyka-bumaga-frukty-i-yagody-d-2-5-cm-252-sht-v-rulone/	
Гравюра блокнот детский «Друзья», 10 листов, лист наклеек, А6	Гравюры	79	5	https://www.sima-land.ru/10576208/gravyura-bloknot-detskiy-druzya-10-listov-list-nakleek-a6/	С помощью штихеля нарисуйте что-нибудь на листе (штихель будет соскребать верхний тёмный слой, открывая сияющий). Особенности блокнота: Блокнот-гравюра - это безграничное поле для фантазии! Создавайте узоры, рисунки, надписи и делитесь своими шедеврами с друзьями и близкими.
Мыло с картинкой своими руками «Милая принцесса», набор для мыловарения	Мыловарение	189	5	https://www.sima-land.ru/10620704/mylo-s-kartinkoy-svoimi-rukami-milaya-princessa-nabor-dlya-mylovareniya/	Мыловарение — это необыкновенное занятие, которое подарит положительные эмоции и поможет развить креативность, фантазию, мелкую моторику. С помощью этого набора вы сможете создать ароматное мыло своими руками. Как сделать мыло? Устройте творческий вечер для всей семьи: откройте коробку и приступайте к созданию шедевров!
Набор для раскопок «В поисках ящерки»	Наборы для творчества	219	5	https://www.sima-land.ru/10708395/nabor-dlya-raskopok-v-poiskah-yascherki/	Набор для юных исследователей «В поисках ящерки» — это увлекательная раскопка, которая познакомит ребёнка с миром палеонтологии. Внутри спрятан маленький сюрприз — фигурка ящерицы, которую нужно аккуратно извлечь, используя инструменты. Как начать раскопки: Развиваем полезные навыки Этот набор станет отличным подарком для маленьких первооткрывателей. Он подойдёт как для самостоятельной игры, так и для увлекательного времяпровождения с родителями.
Вышивка крестиком «Ангелочек», набор для творчества, 16×18 см	Вышивка	229	0	https://www.sima-land.ru/10732313/vyshivka-krestikom-angelochek-nabor-dlya-tvorchestva-16-18-cm/	С набором для вышивки у вас получится смастерить своими руками настоящий шедевр. Как работать с набором
Набор пайеток «Глазки с ресничками», 18 шт., размер 1 шт 2 см, разноцветные	Создание игрушек и кукол	32	4.7	https://www.sima-land.ru/825494/nabor-payetok-glazki-s-resnichkami-18-sht-razmer-1-sht-2-cm-raznocvetnye/	Декоративные глазки не имеют клеевой основы. Рекомендуется крепить их на игрушку с помощью клея (в комплект не входит).
Бусины для творчествах пластик "Цветочки" (набор 150 шт) 0,6х0,6 см	Принадлежности для творчества	57	5	https://www.sima-land.ru/1056513/businy-dlya-tvorchestvah-plastik-cvetochki-nabor-150-sht-0-6h0-6-cm/	Если пытаться перечислить варианты использования пуговиц в декоративных целях помимо их прямого назначения, легко можно сбиться со счёта! Яркие и оригинальные пуговки самых разных форм и размеров украсят оригинальные браслеты, бусы и серёжки, картины и панно, рамки для фотографий, альбомы, открытки и даже необычные букеты! Творите с удовольствием, и пусть ничто не ограничивает вашу фантазию!
Краски масляные, 12 цветов, в пластиковой тубе, 12 мл	Товары для художников	132	2.7	https://www.sima-land.ru/1100005/kraski-maslyanye-12-cvetov-v-plastikovoy-tube-12-ml/	Художественная масляная краска предназначена для профессиональных художников. Приобретайте товары для творчества в нашем интернет-магазине!
Разделители для бусин «Солнце», цвет белый в серебре	Сундучок Пандоры	40	5	https://www.sima-land.ru/1190638/razdeliteli-dlya-busin-solnce-cvet-belyy-v-serebre/	Благодаря лаконичной форме разделитель поможет вам составлять неповторимые композиции и обновлять образ изо дня в день. Универсальная деталь станет любимым элементом в коллекции украшений. Создайте аксессуар, приуроченный к особому моменту вашей жизни, и заряжайтесь приятными эмоциями, надевая его с любимым нарядом.
Сердечки декоративные, набор 200 шт., 1 см, цвет красный	Принадлежности для творчества	119	5	https://www.sima-land.ru/1195938/serdechki-dekorativnye-nabor-200-sht-1-cm-cvet-krasnyy/	Декоративные сердечки — это эффектное украшение любого торжества. Они добавят романтики, ярких красок и со вкусом завершат любое поздравление. Ими можно декорировать интерьер, красиво оформить подарок или произвести впечатление на свою вторую половинку, выложив сердечную дорожку. Такой невесомый декор надолго сохранит свой первоначальный вид. И, конечно, это незаменимый атрибут для церемонии бракосочетания. Любая фотография, где вы стоите под дождём красочных сердец, станет самой любимой! 
Штекер "Бабочка Ольви" 10х8см/30см, МИКС	Обустройство сада	10	4.6	https://www.sima-land.ru/1201401/shteker-babochka-olvi-10h8sm-30sm-miks/	
Нитки 40/2, 200 м, сиреневые №196	Принадлежности для шитья	12.5	5	https://www.sima-land.ru/1217856/nitki-40-2-200-m-sirenevye-196/	Нитки 40/2 используются для всех основных видов швов. Они сделаны из полиэстера, который отличается прочностью и надёжно скрепит части изделия. Благодаря своим универсальным свойствам нити находят широкое применение. Они используются при производстве тонких и средних тканей, костюмной, джинсовой одежды, а также в мебельной, обувной и автомобильной промышленности. Применяются при пошиве трикотажа, постельных принадлежностей, верхней, спортивной одежды, домашнего текстиля и прочего. 
